ASIN,Product Name,Amazon URL,HTTP Status,Reason,Title,Price,Availability
B0BFQLHRXK,Foreo Luna 4 Face Massager,https://www.amazon.com/dp/B0BFQLHRXK?tag=hotproduct033-20,ok,suspicious_price,FOREO LUNA 4 Face Cleansing Brush - Firming Face Massager - Anti Aging Care - Enhances Absorption - Simple Skin Care Tools - Sensitive Skin,149.29,In Stock
B00TQ0A316,BaByliss PRO Titanium Hair Iron,https://www.amazon.com/dp/B00TQ0A316?tag=hotproduct033-20,ok,suspicious_price,"BaBylissPRO Nano Titanium Flat Iron Hair Straightener, Digital Flat Iron for Pro Salon Results, Styling Tool for All Hair Types",76.99,In Stock
B0FMRXP1HP,Silk'n Flash&Go Hair Removal Device,https://www.amazon.com/dp/B0FMRXP1HP?tag=hotproduct033-20,not_found,listing_removed,,,
B07WYY6KKC,Tria Beauty Hair Removal Laser 4X,https://www.amazon.com/dp/B07WYY6KKC?tag=hotproduct033-20,ok,suspicious_price,"Braun IPL, Silk·Expert Pro 5, IPL Hair Removal for Women and Men, Permanent Laser Hair Reduction At-Home, 2 Heads, Pouch, IPL5137",399.99,In Stock
B072NNC2LR,Tatcha The Water Cream Moisturizer,https://www.amazon.com/dp/B072NNC2LR?tag=hotproduct033-20,ok,no_buybox_offer,"TATCHA The Water Cream | Cream Moisturizer for Face, Optimal Hydration For Pure Poreless Skin",,See All Buying Options
B00SR8Z74Q,Sisley Paris Black Rose Cream Mask,https://www.amazon.com/dp/B00SR8Z74Q?tag=hotproduct033-20,ok,no_buybox_offer,"Sisley Paris Black Rose Cream Mask - 60 mL - Instant Youth Face Mask to Smooth, Plump & Illuminate Skin",,See All Buying Options
B0C83MRDQS,Dior Capture Totale Super Potent Serum,https://www.amazon.com/dp/B0C83MRDQS?tag=hotproduct033-20,ok,no_buybox_offer,Dior Capture Totale Cell Energy Super Potent Le Serum Jumbo Size 2.5oz / 75mL,,See All Buying Options
B0CCPHGWR2,Pat McGrath Labs Skin Fetish Foundation,https://www.amazon.com/dp/B0CCPHGWR2?tag=hotproduct033-20,ok,no_buybox_offer,PAT McGRATH LABS Skin Fetish: Divine Powder Blush Electric Bloom,,See All Buying Options
B084CWTSZM,Guerlain Orchidée Impériale Cream,https://www.amazon.com/dp/B084CWTSZM?tag=hotproduct033-20,ok,suspicious_price,Guerlain MULTI-WRINKLE MINIMIZER EYE CREAM,80.64,
B0FR9XSS5Q,Augustinus Bader The Rich Cream,https://www.amazon.com/dp/B0FR9XSS5Q?tag=hotproduct033-20,blocked,scrape_blocked,,,
B0F1CWK9LF,James by Percival Everett,https://www.amazon.com/dp/B0F1CWK9LF?tag=hotproduct033-20,blocked,scrape_blocked,,,
B0G912K6R1,Orbital by Samantha Harvey,https://www.amazon.com/dp/B0G912K6R1?tag=hotproduct033-20,blocked,scrape_blocked,,,
B0F45BSJ11,Wind and Truth by Brandon Sanderson,https://www.amazon.com/dp/B0F45BSJ11?tag=hotproduct033-20,blocked,scrape_blocked,,,
B0FQ5J34GT,The Let Them Theory by Mel Robbins,https://www.amazon.com/dp/B0FQ5J34GT?tag=hotproduct033-20,not_found,listing_removed,,,
B0CLKYLQFZ,Never Lie by Freida McFadden,https://www.amazon.com/dp/B0CLKYLQFZ?tag=hotproduct033-20,blocked,scrape_blocked,,,
0120855038,Fourth Wing by Rebecca Yarros,https://www.amazon.com/dp/0120855038?tag=hotproduct033-20,ok,suspicious_price,"The Empyrean Series 3 Books Collection Set By Rebecca Yarros (Fourth Wing, Iron Flame & Onyx Storm)",47.99,In Stock
B01MDTVZTZ,The Ordinary Niacinamide 10% + Zinc 1%,https://www.amazon.com/dp/B01MDTVZTZ?tag=hotproduct033-20,ok,suspicious_price,"The Ordinary Niacinamide 10% + Zinc 1%, Smoothing Serum for Blemish-Prone Skin",6.0,In Stock
B0037LRZHA,Sunday Riley Good Genes Glycolic Acid Treatment,https://www.amazon.com/dp/B0037LRZHA?tag=hotproduct033-20,ok,suspicious_price,Sunday Riley Good Genes All-in-One Lactic Acid Treatment Face Serum,59.5,In Stock
B075ZVNLTF,Fenty Beauty Pro Filt'r Soft Matte Foundation,https://www.amazon.com/dp/B075ZVNLTF?tag=hotproduct033-20,ok,no_buybox_offer,FENTY BEAUTY Pro Filt'r Soft Matte Longwear Foundation -150,,See All Buying Options
B0FL46N2YF,Urban Decay All Nighter Long-Lasting Makeup Setting Spray,https://www.amazon.com/dp/B0FL46N2YF?tag=hotproduct033-20,ok,no_buybox_offer,"Urban Decay All Nighter Setting Spray Duo Bundle - Full Size (4 Fl Oz) & Travel Size (1 Fl Oz) - Natural Finish - Waterproof Makeup Setting Spray - Smudge-Proof, Transfer-Resistant - Makeup Primer Set",,See All Buying Options
B01DHA242G,Too Faced Better Than Sex Mascara,https://www.amazon.com/dp/B01DHA242G?tag=hotproduct033-20,ok,suspicious_price,Too Faced Better Than Sex Waterproof Mascara | Volume + Length with Hourglass Brush,29.0,In Stock
B01M5CZAXM,Anastasia Beverly Hills Brow Wiz Pencil,https://www.amazon.com/dp/B01M5CZAXM?tag=hotproduct033-20,ok,no_buybox_offer,"Anastasia Beverly Hills Brow Wiz - Ultra-Slim Retractable Eyebrow Pencil for Hair-Like Strokes, Natural Precision Definition, Longwear Waterproof Smudge-Proof for Filling & Shaping Brows",,See All Buying Options
B08PPVCCST,Steelcase Leap V2 Office Chair,https://www.amazon.com/dp/B08PPVCCST?tag=hotproduct033-20,ok,no_buybox_offer,"Steelcase Leap V2 Office Chair - Remanufactured by Crandall Office - Ergonomic, Fully Adjustable, 12-Year Warranty, Black Fabric - Premium Work & Home Office Seating",,See All Buying Options
B0G6ZX2MGW,Autonomous SmartDesk Pro,https://www.amazon.com/dp/B0G6ZX2MGW?tag=hotproduct033-20,ok,no_buybox_offer,"Autonomous Gray Electric Standing Desk 5 48×24 Inches, Adjustable Height Desk Stand Up Desk, Sit Stand 3 Memory Presets, Cable Tray for Home Office & Computer Workstation",,See All Buying Options
B0CNH22LKJ,Homall Gaming Chair Racing Style,https://www.amazon.com/dp/B0CNH22LKJ?tag=hotproduct033-20,ok,no_buybox_offer,Homall LED Gaming Massage Recliner Chair Racing Style Single Living Room Sofa Comfortable Ergonomic Home Theater Seating(Red),,See All Buying Options
B0CB1DRDJ1,Bestier 95 inch L-Shaped Gaming Desk,https://www.amazon.com/dp/B0CB1DRDJ1?tag=hotproduct033-20,ok,suspicious_price,"Bestier L Shaped Gaming Desk with Power Outlets,58 LED Small Corner Desk with Reversible Storage Shelves,Pink Computer Desk with Headset Hooks Desk for Living Room and Dormitory",149.99,Only 2 left in stock - order soon.
B0C7S66CW5,Prepac Monterey Bookcase,https://www.amazon.com/dp/B0C7S66CW5?tag=hotproduct033-20,ok,no_buybox_offer,"Prepac Milo Mid-Century Modern Bookcase with Six Shelves, Two Doors, and Brushed Brass-Finished Knobs",,See All Buying Options
B004S6L2WW,Furinno Turn-N-Tube 5-Tier Bookcase,https://www.amazon.com/dp/B004S6L2WW?tag=hotproduct033-20,ok,suspicious_price,"FURINNO Turn-N-Tube 5-Tier Corner Square Rack Display Shelf, Round, Espresso/Black",49.99,Only 10 left in stock (more on the way).
B0BDT54SGD,Bose QuietComfort 45 Headphones,https://www.amazon.com/dp/B0BDT54SGD?tag=hotproduct033-20,ok,suspicious_price,Bose QuietComfort 45 SE Noise Cancelling Over-the-Ear Headphones,299.0,In Stock
B0DV1TSSDV,Skullcandy Crusher Evo Wireless Headphones,https://www.amazon.com/dp/B0DV1TSSDV?tag=hotproduct033-20,ok,no_buybox_offer,Skullcandy Crusher EVO Wireless Noise-Isolating Over-Ear Headphones Bundle - Black,,See All Buying Options
B0B8TDQZ5K,Samsung Galaxy Buds2 Pro,https://www.amazon.com/dp/B0B8TDQZ5K?tag=hotproduct033-20,ok,no_buybox_offer,Samsung Galaxy Buds2 Pro True Wireless Bluetooth Earbud Headphones - White,,See All Buying Options
B0DXP6TSJ7,Nothing Ear (2) True Wireless Earbuds,https://www.amazon.com/dp/B0DXP6TSJ7?tag=hotproduct033-20,ok,suspicious_price,"CMF By Nothing Buds 2 48dB Hybrid ANC True Wireless Earbuds, Strong and Comfort Noise Cancelling, Ultra Bass and Dirac Sound, in-Ear Detection, 55H Playtime, 6ENC Mics, Bluetooth 5.4 Dark Grey",49.0,
B0B7838HH6,Bose QuietComfort Earbuds II,https://www.amazon.com/dp/B0B7838HH6?tag=hotproduct033-20,ok,suspicious_price,"Bose QuietComfort Earbuds II, Wireless, Bluetooth, Proprietary Active Noise Cancelling Technology in-Ear Headphones with Personalized Noise Cancellation & Sound, Soapstone",149.0,
B0BRYQ641F,Harman Kardon Onyx Studio 8 Speaker,https://www.amazon.com/dp/B0BRYQ641F?tag=hotproduct033-20,ok,suspicious_price,"Harman Kardon Onyx Studio 8,Black",489.9,
B0C6PG4GR3,Ring Alarm 8-Piece Security Kit,https://www.amazon.com/dp/B0C6PG4GR3?tag=hotproduct033-20,ok,no_buybox_offer,Ring Alarm 8-Piece Kit with Ring Battery Doorbell Plus,,See All Buying Options
B08WRZJJGM,Lorex 4K Ultra HD IP Security System,https://www.amazon.com/dp/B08WRZJJGM?tag=hotproduct033-20,ok,no_buybox_offer,Lorex 4K Security Camera System Ultra HD IP 8-Channel 2TB NVR System with 8 POE Smart Deterrence 4K 8MP Indoor/Outdoor IP Cameras (Renewed),,See All Buying Options
B097KBD9NQ,Swann 8 Channel 4K DVR Security System,https://www.amazon.com/dp/B097KBD9NQ?tag=hotproduct033-20,ok,no_buybox_offer,8 Channel 4K Ultra HD DVR Security Recorder (Cameras Sold Separately) - SRDVR-85680W,,See All Buying Options
B0CCPXMZWG,Ring Indoor Cam 2nd Gen,https://www.amazon.com/dp/B0CCPXMZWG?tag=hotproduct033-20,ok,suspicious_price,"Ring Indoor Cam (2nd Gen), White with Ring Pet Tag",29.99,In Stock
B0BWF4MQ8X,Garmin Forerunner 965 GPS Running Watch,https://www.amazon.com/dp/B0BWF4MQ8X?tag=hotproduct033-20,not_found,listing_removed,,,
B0CXN9K8LD,Fitbit Charge 6 Fitness Tracker,https://www.amazon.com/dp/B0CXN9K8LD?tag=hotproduct033-20,ok,no_buybox_offer,"Fitbit Charge 6 Fitness Tracker with Heart Rate, GPS, Obsidian",,See All Buying Options
B0CFT1CC3J,Suunto Race GPS Multisport Watch,https://www.amazon.com/dp/B0CFT1CC3J?tag=hotproduct033-20,ok,suspicious_price,"SUUNTO Race: GPS Sports Watch, Large & Bright AMOLED Color Screen, Long Battery Life",399.0,In Stock
B0DW728FT5,Bowflex SelectTech 552 Adjustable Dumbbells,https://www.amazon.com/dp/B0DW728FT5?tag=hotproduct033-20,ok,no_buybox_offer,Adjustable Dumbbell Handle - Replacement for Bowflex SelectTech 552 (Series 2) Adjustable Dumbbells,,See All Buying Options
B0DRSWVTMN,Apple MacBook Pro 14-inch M4 Pro,https://www.amazon.com/dp/B0DRSWVTMN?tag=hotproduct033-20,blocked,scrape_blocked,,,
B09TPWFK6F,ASUS ZenBook Pro 16X OLED,https://www.amazon.com/dp/B09TPWFK6F?tag=hotproduct033-20,ok,suspicious_price,"ASUS ZenBook Pro 16X OLED 16 inch 4K OLED 16:10 Touch Display, Dial, Intel Core i9-12900H, 32GB, 2TB, GeForce RTX 3060 GPU, Windows 11 Pro, Tech Black, UX7602ZM-XB96T",2999.99,Only 1 left in stock - order soon.
B0DYJY82YM,HP EliteBook 840 G10 Business Laptop,https://www.amazon.com/dp/B0DYJY82YM?tag=hotproduct033-20,ok,no_buybox_offer,"HP EliteBook 840 G10 Business Laptop (14"" FHD+ Anti-Glare, Intel 10-Core i5-1335U (> i7-1255U), 32GB DDR5 RAM, 1TB SSD), 5MP Webcam, Backlit KB, Fingerprint, 2x Thunderbolt 4, Wi-Fi 6E, Win 11 Pro",,See All Buying Options
B0FL7BTYKX,Lenovo ThinkPad T14s Gen 4 AMD,https://www.amazon.com/dp/B0FL7BTYKX?tag=hotproduct033-20,ok,no_buybox_offer,"Lenovo ThinkPad T14s Gen 2 Laptop, 14"" FHD Notebook Computer, AMD Ryzen 5 PRO 5650U,16GB DDR4 RAM, 512GB SSD, HDMI, Thunderbolt 4, Windows 11 Pro (Renewed)",,See All Buying Options
B0C6PF997Q,Samsung Galaxy Book3 Pro 360,https://www.amazon.com/dp/B0C6PF997Q?tag=hotproduct033-20,not_found,listing_removed,,,
B0FGGNLY2L,Acer Swift Go 16 OLED Laptop,https://www.amazon.com/dp/B0FGGNLY2L?tag=hotproduct033-20,ok,suspicious_price,"Acer Swift Go 16 Intel Evo AI 16"" Laptop OLED WQXGA+ (3200x2000) Intel Core Ultra 5 Processor 125H 120Hz 8GB RAM 512GB SSD Windows 11 Home Gen 4",599.99,In Stock
B0GM24XLYL,HP Dragonfly Pro Chromebook,https://www.amazon.com/dp/B0GM24XLYL?tag=hotproduct033-20,blocked,scrape_blocked,,,
B0D1DB11TY,HP Envy 17 Laptop,https://www.amazon.com/dp/B0D1DB11TY?tag=hotproduct033-20,ok,suspicious_price,"HP Envy 17 inch Laptop, FHD Touchscreen, Intel Core Ultra 7 155H, 16 GB RAM, 1 TB SSD, Intel Arc Graphics, Windows 11 Home, Copilot Key, 17-cw1010nr (2024)",1759.0,Usually ships within 2 to 3 weeks
B0FLJP4D5V,Lenovo IdeaPad 5 Pro 16 Laptop,https://www.amazon.com/dp/B0FLJP4D5V?tag=hotproduct033-20,blocked,scrape_blocked,,,
B0CV1Y7NLT,LG UltraGear 32GS95UE OLED Monitor,https://www.amazon.com/dp/B0CV1Y7NLT?tag=hotproduct033-20,ok,suspicious_price,LG ‎32GS95UE 32-inch Ultragear OLED Gaming Monitor UHD 240Hz 0.03ms DisplayHDR True Black 400 AMD FreeSync Premium Pro NVIDIA G-Sync HDMI 2.1 DisplayPort Tilt/Height/Swivel Stand Black,1444.06,Only 14 left in stock - order soon.
B0CP6HW894,Samsung Odyssey G9 Super Ultrawide,https://www.amazon.com/dp/B0CP6HW894?tag=hotproduct033-20,ok,suspicious_price,"Samsung 49” Odyssey G9 Series DQHD 1000R Curved Gaming Monitor, 1ms(GtG), VESA DisplayHDR 1000, 240Hz, AMD FreeSync Premium Pro, Height Adjustable Stand, Ultrawide Screen, LS49CG954ENXZA, 2024",1234.99,In Stock
B0CD4KKF6K,Alienware AW3423DWF QD-OLED Monitor,https://www.amazon.com/dp/B0CD4KKF6K?tag=hotproduct033-20,ok,no_buybox_offer,Alienware AW3423DWF Curved QD-OLED Gaming Monitor 34-inch Quantum Dot OLED 0.1Ms 165Hz 21:9 Curved Display (Renewed),,See All Buying Options
B083GRVFXN,Gigabyte M32U 4K Gaming Monitor,https://www.amazon.com/dp/B083GRVFXN?tag=hotproduct033-20,ok,no_buybox_offer,"GIGABYTE M32U - 32"" IPS Gaming Monitor - UHD 3840x2160-144Hz - 1ms MPRT - AMD FreeSync Premium Pro - Type C KVM - HDMI, DP, Type C - Height Adjustable - Black (M32U-SA)",,See All Buying Options
B0F5FP39MK,AOC C27G2 Curved Gaming Monitor,https://www.amazon.com/dp/B0F5FP39MK?tag=hotproduct033-20,ok,suspicious_price,"AOC C27G4H2 27"" Curved Gaming Monitor, FHD 1920x1080, 1500R, 200Hz Refresh Rate, 0.3ms Response Time, Height Adjustable, Black, Xbox PS5 Switch Compatible",149.99,In Stock
B08LB3LZL5,Ninja Foodi 9-in-1 Pressure Cooker,https://www.amazon.com/dp/B08LB3LZL5?tag=hotproduct033-20,blocked,scrape_blocked,,,
B07RH9VRPT,Vitamix 5200 Professional Blender,https://www.amazon.com/dp/B07RH9VRPT?tag=hotproduct033-20,ok,no_buybox_offer,Vitamix 5200 5200 Countertop Blender 64 oz. Red (Renewed),,See All Buying Options
B0C59MGW5J,KitchenAid Artisan Series Stand Mixer,https://www.amazon.com/dp/B0C59MGW5J?tag=hotproduct033-20,ok,suspicious_price,"KitchenAid Artisan Series 5 Quart Tilt Head Stand Mixer, KSM150PS, Porcelain",499.95,In Stock
B0D4FJ5JSB,Blackstone 36 inch Outdoor Flat Top Griddle,https://www.amazon.com/dp/B0D4FJ5JSB?tag=hotproduct033-20,ok,unavailable,Blackstone 36 Inch Gas Griddle with Hood Cooking Station 4 Burner Flat Top Gas Grill Propane Fuelled Restaurant Grade Professional 36” Outdoor Griddle Station with Side Shelf,576.86,Temporarily out of stock. We are working hard to be back in stock. Place your order and we’ll email you when we have an estimated delivery date. You won’t be charged until the item ships.
B0B7VT42PK,Ninja DZ201 Foodi 8 Quart Air Fryer,https://www.amazon.com/dp/B0B7VT42PK?tag=hotproduct033-20,ok,no_buybox_offer,"Ninja DZ201 Foodi 6-in-1 2-Basket Air Fryer with DualZone Technology, 8-Quart Capacity -Dark Grey Stainless- (Renewed)",,See All Buying Options
B09XB4ZD87,Cuisinart Coffee Center Grind & Brew Plus,https://www.amazon.com/dp/B09XB4ZD87?tag=hotproduct033-20,ok,no_buybox_offer,"Cuisinart SS-GB1 Coffee Center Grind and Brew Plus, Built-in Coffee Grinder, Coffeemaker and Single-Serve Brewer with HomeBarista Reusable Filter Cup, Black/Silver, 12-Cup",,See All Buying Options
B0D7FZ97T5,TP-Link Tapo P115 Mini Smart Plug 4-Pack,https://www.amazon.com/dp/B0D7FZ97T5?tag=hotproduct033-20,ok,suspicious_price,"TP-Link 𝗧𝗮𝗽𝗼 Smart Plug Wi-Fi Mini, Energy Monitoring, Compatible with Alexa & Google Home & Samsung SmartThings, Timer, 15A/1800W Max, ETL Certified, 2.4G Wi-Fi Only, Tapo P115(4-Pack)",32.99,In Stock
B0B3Q14Q1N,Honeywell Home RTH9585WF1004 Wi-Fi Thermostat,https://www.amazon.com/dp/B0B3Q14Q1N?tag=hotproduct033-20,ok,no_buybox_offer,Honeywell Home RENEWRTH9585WF Wi-Fi Smart Color Thermostat (Renewed),,See All Buying Options
B09WDL1J8J,Govee LED Strip Lights 65.6ft,https://www.amazon.com/dp/B09WDL1J8J?tag=hotproduct033-20,ok,suspicious_price,"Govee Outdoor LED Strip Lights, 65.6ft Smart Led Strip Lights Work with Alexa and Google Assistant, App Control, IP65 Waterproof, RGBIC Outdoor Lights for Patio, Eave, Patio Decorations",114.99,In Stock
B0DF86746T,OM System OM-1 Mark II Camera,https://www.amazon.com/dp/B0DF86746T?tag=hotproduct033-20,ok,no_buybox_offer,OM SYSTEM OM-1 Mark II Mirrorless Camera (Body Only) (Renewed),,See All Buying Options
B0G59XNHB9,Lowepro ProTactic 450 AW II Camera Bag,https://www.amazon.com/dp/B0G59XNHB9?tag=hotproduct033-20,ok,no_buybox_offer,"ProTactic BP 450 AW III 28L Camera Backpack, Black",,See All Buying Options
B0DNRPZTM8,K9 Ballistics Tough Bolster Dog Bed,https://www.amazon.com/dp/B0DNRPZTM8?tag=hotproduct033-20,ok,no_buybox_offer,"K9 Ballistics Tough Ripstop Round Bolster Dog Bed, Donut Shape, Scratch-Resistant, Machine Washable - Medium, Taupe Premium Finish",,See All Buying Options
B0CZPPQD1M,Baby Trend Expedition Jogger Travel System,https://www.amazon.com/dp/B0CZPPQD1M?tag=hotproduct033-20,ok,suspicious_price,"Baby Trend Expedition® Zero Flat Jogger Travel System with LED Lights, Dash Grey",208.55,Only 2 left in stock (more on the way).
B000IMQ40U,Melissa & Doug Wooden Activity Table,https://www.amazon.com/dp/B000IMQ40U?tag=hotproduct033-20,ok,suspicious_price,Melissa & Doug Deluxe Wooden Multi-Activity Play Table for Playroom,213.99,In Stock
B0DXSYTFY7,Lovevery Play Gym Baby Toy,https://www.amazon.com/dp/B0DXSYTFY7?tag=hotproduct033-20,not_found,listing_removed,,,
B09NBB17LH,Summer Infant Wide View Digital Baby Monitor,https://www.amazon.com/dp/B09NBB17LH?tag=hotproduct033-20,blocked,scrape_blocked,,,
B0BZ7756C5,Brother MFC-J995DW INKvestment Tank Printer,https://www.amazon.com/dp/B0BZ7756C5?tag=hotproduct033-20,ok,no_buybox_offer,Brother MFC-J4335DW INKvestment Tank All-in-One Printer with Duplex and Wireless Printing Plus Up to 1-Year of Ink in-Box (Renewed Premium),,See All Buying Options
B0C6V54N2S,Jabra Evolve2 40 Wired Headset,https://www.amazon.com/dp/B0C6V54N2S?tag=hotproduct033-20,ok,suspicious_price,Jabra Evolve2 40 SE Headset,68.45,Only 1 left in stock - order soon.
B009FFYIJA,Swingline GBC Fusion 1100L Laminator,https://www.amazon.com/dp/B009FFYIJA?tag=hotproduct033-20,ok,no_buybox_offer,"GBC Thermal Laminator Machine, Fusion 1100L, 9 Inch, 4 Min Warm-up, 3 or 5 Mil, with 10 EZUse Laminating Pouches (1703074)",,See All Buying Options
B08VPFB5G3,Amazon Basics Mesh Office Desk Organizer,https://www.amazon.com/dp/B08VPFB5G3?tag=hotproduct033-20,ok,suspicious_price,"Amazon Basics Mesh Desk Organizer with Pen Holder, Pullout Drawer and Office Caddy Storage, 9.25"" x 4.53"" x 3.94"", Black",10.49,In Stock
B08PW73XGF,Post-it Super Sticky Notes 12-Pack,https://www.amazon.com/dp/B08PW73XGF?tag=hotproduct033-20,ok,suspicious_price,"Post-it Super Sticky Notes, Assorted Bright Colors, 3x3 in, 15 Pads/Pack, 45 Sheets/Pad, 2X the Sticking Power, Recyclable, Multi-Color",0.96,
B0CS48D3NS,Garmin inReach Mini 2 Satellite Communicator,https://www.amazon.com/dp/B0CS48D3NS?tag=hotproduct033-20,ok,no_buybox_offer,"Garmin inReach® Messenger Handheld Satellite Communicator, Global Two-Way Messaging (Renewed)",,See All Buying Options
B0753NBMJ5,Jetboil Flash Camping Stove System,https://www.amazon.com/dp/B0753NBMJ5?tag=hotproduct033-20,ok,no_buybox_offer,"Jetboil Flash Camping and Backpacking Stove System, Portable Propane/Isobutane Burner with Cooking Cup for Outdoor Trips and Hiking",,See All Buying Options
B0CTD455LJ,Sea to Summit Spark SP III Sleeping Bag,https://www.amazon.com/dp/B0CTD455LJ?tag=hotproduct033-20,ok,no_buybox_offer,Sea to Summit Spark Ultralight Down Sleeping Bag,,See All Buying Options
B0FTTZ9SPR,Patagonia Nano Puff Jacket,https://www.amazon.com/dp/B0FTTZ9SPR?tag=hotproduct033-20,ok,no_buybox_offer,Men's Nano Puff Jacket,,See All Buying Options
B0DM3DB4SX,Arc'teryx Beta AR Jacket,https://www.amazon.com/dp/B0DM3DB4SX?tag=hotproduct033-20,blocked,scrape_blocked,,,
B08MMP4ZTN,Head Radical MP Tennis Racket,https://www.amazon.com/dp/B08MMP4ZTN?tag=hotproduct033-20,ok,no_buybox_offer,HEAD Radical MP G360+ Tennis Racquet,,See All Buying Options
B0FP3Q99XK,TaylorMade Stealth 2 Driver,https://www.amazon.com/dp/B0FP3Q99XK?tag=hotproduct033-20,ok,no_buybox_offer,Build a Custom TaylorMade Stealth 2 Plus 10.5* Driver,,See All Buying Options
B08QJC5YPX,Spalding NBA Outdoor Basketball Size 7,https://www.amazon.com/dp/B08QJC5YPX?tag=hotproduct033-20,ok,suspicious_price,Spalding Outdoor Rubber Basketballs | Performance Rubber Cover Designed for Outdoor Play | Multiple Sizes & Colors,29.99,In Stock
B0090VLJL4,Franklin Sports Backyard Soccer Set,https://www.amazon.com/dp/B0090VLJL4?tag=hotproduct033-20,ok,suspicious_price,"Franklin Sports Kids Mini Soccer Goal Set - Backyard/Indoor Mini Net and Ball with Pump - 22"" x 17""",39.99,In Stock
B09TG9PQ8M,Yonex Arcsaber 11 Pro Badminton Racket,https://www.amazon.com/dp/B09TG9PQ8M?tag=hotproduct033-20,ok,no_buybox_offer,Yonex Arcsaber 11 PRO Badminton Racket (Grayish Pearl) (3UG5) (Unstrung),,See All Buying Options
B0FFJ6TMGR,Life Fitness C3 Upright Bike,https://www.amazon.com/dp/B0FFJ6TMGR?tag=hotproduct033-20,blocked,scrape_blocked,,,
B01499GH36,Precor EFX 221 Elliptical Fitness Crosstrainer,https://www.amazon.com/dp/B01499GH36?tag=hotproduct033-20,blocked,scrape_blocked,,,
B07BLLRM8R,Schumacher SC1281 100A Battery Charger,https://www.amazon.com/dp/B07BLLRM8R?tag=hotproduct033-20,ok,suspicious_price,"Schumacher Electric 6A Car Battery Charger and 100A Engine Starter, 5-in-1 Solution, Maintainer, 30A Boost, for 6V/12V Power Sport, Automotive, and Marine Batteries, SC1281",89.99,In Stock
B0G1SLNB9W,Mpow Car Phone Holder Air Vent Mount,https://www.amazon.com/dp/B0G1SLNB9W?tag=hotproduct033-20,ok,suspicious_price,"Car Phone Holder Mount Air Vent [Stable Grip Clip], Hands-Free Cell Phone Stand, Anti-Slip Silicone, Universal Fit for All Smartphones (4.0""-7.2"") Thick Case Friendly",1.46,See All Buying Options
B0C3JNJPZ7,Withings Body+ Smart Scale,https://www.amazon.com/dp/B0C3JNJPZ7?tag=hotproduct033-20,ok,suspicious_price,"WITHINGS Body Smart - Accurate Scale for Body Weight and Fat Percentage, Body Composition Wi-Fi and Bluetooth Weight Scale, Baby Weight Scale, Smart Scale Apple Health Compatible, Bathroom Scale",129.95,In Stock
B0CM9R944Q,BioIntelliSense BioButton Wearable Monitor,https://www.amazon.com/dp/B0CM9R944Q?tag=hotproduct033-20,ok,suspicious_price,Bioheart | 24/7 Continuous Heart Monitor | No Prescription Needed | Smart Wearable | Chest Strap | One Month Subscription Included,249.99,Only 4 left in stock - order soon.
B0BKLZGCRZ,Beurer Massage Chair Pad,https://www.amazon.com/dp/B0BKLZGCRZ?tag=hotproduct033-20,ok,suspicious_price,"Beurer UHP48N Lux Heated Body Pillow, Lumbar Support Pillow for Back Pain Relief, Microplush Heated Pillow with 6 Temperature Settings and Auto Shut-Off, Back Pillow for Sore Muscles",34.99,See All Buying Options
B0CD8V6MM6,Sharper Image Powerboost Deep Tissue Massager,https://www.amazon.com/dp/B0CD8V6MM6?tag=hotproduct033-20,ok,suspicious_price,"Sharper Image PowerBoost Core Mini Massage Gun [2026 Version] Deep Tissue Percussion Massager with 6 Speeds for Back & Full Body Muscle Pain Relief, Portable with 4 Attachments & Carry Pouch",119.99,In Stock
B09XGPRD3W,Carex Day-Light Classic Plus Therapy Lamp,https://www.amazon.com/dp/B09XGPRD3W?tag=hotproduct033-20,ok,suspicious_price,"Carex Day-Light Sky Bright Sunlight Therapy Lamp, 10000 LUX Therapy Lamp at 12 Inches, LED Bright White Light with Adjustable Height and Brightness Levels for Mood, White",94.99,In Stock
B00CEYD72I,Nature Made Vitamin D3 2000 IU 260 Gummies,https://www.amazon.com/dp/B00CEYD72I?tag=hotproduct033-20,ok,no_buybox_offer,"Nature Made Vitamin D3 2000 IU Per Serving Gummies, Bone, Teeth, Muscle and Immune Health Support, 75 Day Supply, 150 Vitamin D Gummies for Adults",,See All Buying Options
B0739KKHWL,Nordic Naturals Ultimate Omega Fish Oil,https://www.amazon.com/dp/B0739KKHWL?tag=hotproduct033-20,ok,no_buybox_offer,"Nordic Naturals Ultimate Omega, Lemon Flavor - 90 Soft Gels - 1280 mg Omega-3 - High-Potency Omega-3 Fish Oil Supplement with EPA & DHA - Promotes Brain & Heart Health - Non-GMO - 45 Servings",,See All Buying Options
B0DV7JN7ZD,Theragun Mini 2nd Gen Percussive Massager,https://www.amazon.com/dp/B0DV7JN7ZD?tag=hotproduct033-20,ok,no_buybox_offer,"TheraGun Mini (3rd Generation) by Therabody – Ultra-Portable Massage Gun and Travel Essential for Fast, Effective Pain and Tension Relief Anywhere (Black)",,See All Buying Options
B07XVZ3D3Z,Samsonite GlobeTrotter Double Bill Organizer,https://www.amazon.com/dp/B07XVZ3D3Z?tag=hotproduct033-20,ok,no_buybox_offer,"Samsonite Pro Double Compartment Briefcase, Black, One Size",,See All Buying Options
B0DJRP7SKD,Samsung Galaxy Watch Ultra,https://www.amazon.com/dp/B0DJRP7SKD?tag=hotproduct033-20,ok,no_buybox_offer,Samsung Galaxy Watch Ultra (2024) 47mm LTE AI Smartwatch Titanium Gray with Black Band (Renewed),,See All Buying Options
B0CG9P8YFW,Withings ScanWatch 2 Hybrid Smartwatch,https://www.amazon.com/dp/B0CG9P8YFW?tag=hotproduct033-20,ok,no_buybox_offer,"WITHINGS ScanWatch 2 - Hybrid Smart Watch, Heart Rate Monitoring, Fitness Tracker, Cycle Tracker, Sleep Monitoring, GPS Tracker, 30-Day Battery Life, Android & Apple Compatible, HSA/FSA",,See All Buying Options
B0C7W12RN2,Meta Quest 3 Mixed Reality Headset,https://www.amazon.com/dp/B0C7W12RN2?tag=hotproduct033-20,ok,suspicious_price,Meta Quest 3 128Gb – bahnbrechende Mixed Reality – leistungsstarke Technologie – Asgarth's Wrath 2 Bundle,669.0,Only 1 left in stock - order soon.
B08JHHYPZL,Makita XFD131 18V LXT Drill Driver Kit,https://www.amazon.com/dp/B08JHHYPZL?tag=hotproduct033-20,ok,no_buybox_offer,Makita XFD131-R 18V LXT Brushless Lithium-Ion 1/2 in. Cordless Drill/Driver Kit (3 Ah) (Renewed),,See All Buying Options
B0008G342C,DeWalt DW735X 13-inch Planer,https://www.amazon.com/dp/B0008G342C?tag=hotproduct033-20,ok,no_buybox_offer,DEWALT DW735R Heavy-Duty 15 Amp 13-Inch Benchtop Planer (Renewed),,See All Buying Options
