ASIN,Product Name,Amazon URL,HTTP Status,Reason,Title,Price,Availability
B0DGJBQSJY,Apple AirPods Max,https://www.amazon.com/dp/B0DGJBQSJY?tag=hotproduct033-20,ok,no_buybox_offer,"Apple AirPods Max Wireless Over-Ear Headphones, Pro-Level Active Noise Cancellation, Transparency Mode, Personalized Spatial Audio, USB-C Charging, Bluetooth Headphones for iPhone - Purple",,See All Buying Options
B0F9S5NFJT,Sony ULT Field 7 Speaker,https://www.amazon.com/dp/B0F9S5NFJT?tag=hotproduct033-20,ok,no_buybox_offer,Sony ULT Field 7 Wireless Portable Bluetooth Karaoke Party Speaker (Renewed Premium),,See All Buying Options
B0D96TXTM9,Nikon Z9 Camera,https://www.amazon.com/dp/B0D96TXTM9?tag=hotproduct033-20,not_found,listing_removed,,,
B01K31X4HG,Herman Miller Aeron Chair,https://www.amazon.com/dp/B01K31X4HG?tag=hotproduct033-20,ok,no_buybox_offer,Herman Miller Aeron Chair Size B Fully Loaded Posture Fit,,See All Buying Options
B09QF4TSZF,"Leica M11 Monochrom Digital Rangefinder Camera, Black",https://www.amazon.com/dp/B09QF4TSZF?tag=hotproduct033-20,ok,no_buybox_offer,Leica M11 Digital Rangefinder Camera (Black),,See All Buying Options
B09QF1H3VF,Dell XPS 17 Laptop,https://www.amazon.com/dp/B09QF1H3VF?tag=hotproduct033-20,ok,no_buybox_offer,Leica M11 Digital Rangefinder Camera (Silver),,See All Buying Options
B0DXMXY3SC,Samsung Neo QLED TV 55,https://www.amazon.com/dp/B0DXMXY3SC?tag=hotproduct033-20,ok,unavailable,"Samsung 55-Inch Class Neo QLED QN70F 4K Mini LED Smart TV (2025 Model) NQ4 AI Gen2 Processor, Quantum Matrix Technology Slim, Motion Xcelerator 144Hz, Samsung Vision AI, Alexa Built-in",,Temporarily out of stock. We are working hard to be back in stock. Place your order and we’ll email you when we have an estimated delivery date. You won’t be charged until the item ships.
B0BDGJ24QQ,GoPro Hero11 Black,https://www.amazon.com/dp/B0BDGJ24QQ?tag=hotproduct033-20,ok,no_buybox_offer,"GoPro HERO11 (Hero 11) Black - Waterproof Action Camera with 5.3K Video, 27MP Photos, 1/1.9"" Sensor, Live Streaming, Webcam, Stabilization + 64GB Card, 50 Piece Accessory Kit and 2 Extra Batteries",,See All Buying Options
B0CKRYL4X4,Samsung Galaxy Tab S9 Ultra,https://www.amazon.com/dp/B0CKRYL4X4?tag=hotproduct033-20,ok,no_buybox_offer,"SAMSUNG Galaxy Tab S9 Ultra 512GB 14.6"" Wi-Fi 6E Android Tablet - Beige (Renewed)",,See All Buying Options
B0G6T4VVDC,Lenovo Yoga 9i,https://www.amazon.com/dp/B0G6T4VVDC?tag=hotproduct033-20,ok,no_buybox_offer,"NIMO 17.3"" FHD IPS Laptop, Intel Core i3-1215U (Beats i5-1135G7 Class), 16GB RAM, 512GB SSD, Windows 11 Home, Wi-Fi 6, Backlit Keyboard, Fingerprint, USB-C 65W Fast Charge, Bluetooth 5.2, 180° View",,See All Buying Options
B0CZ1RTYQY,Dell UltraSharp 32 Monitor,https://www.amazon.com/dp/B0CZ1RTYQY?tag=hotproduct033-20,ok,no_buybox_offer,"Dell S2425HS Monitor - 23.8 Inch, FHD (1920x1080) Display, 100Hz Refresh Rate 1500:1 Contrast Ratio, TÜV Rheinland Eye Comfort 4 Star, Integrated 2x5W Speaker, Height/Tilt/Swivel/Pivot - Ash White",,See All Buying Options
B0DLBTPDCS,Apple Mac Mini M4 (2024),https://www.amazon.com/dp/B0DLBTPDCS?tag=hotproduct033-20,ok,no_buybox_offer,"Apple 2024 Mac mini Desktop Computer with M4 chip with 10‑core CPU and 10‑core GPU: Built for Apple Intelligence, 16GB Unified Memory, 256GB SSD Storage, Gigabit Ethernet. Works with iPhone/iPad",,See All Buying Options
B0D1SNZCG9,"La Mer Moisturizing Fresh Cream 1 Oz, White",https://www.amazon.com/dp/B0D1SNZCG9?tag=hotproduct033-20,ok,no_buybox_offer,"La Mer Moisturizing Fresh Cream 1 Oz, White",,See All Buying Options
B0F323N949,Alienware m18 R2 Gaming Laptop,https://www.amazon.com/dp/B0F323N949?tag=hotproduct033-20,ok,no_buybox_offer,"Dell Alienware M18 R2 Gaming Laptop, NVIDIA RTX 4090 16GB GDDR6, Intel i9 14900HX, 18"" 2.5K QHD+ (2560x1600) 165Hz 3ms, 64 GB DDR5, 2 TB SSD, WiFi 7, Bluetooth 5.4, Windows 11 Pro",,See All Buying Options
B0CS64LL89,HP OMEN 16 Gaming Laptop RTX 4070,https://www.amazon.com/dp/B0CS64LL89?tag=hotproduct033-20,ok,no_buybox_offer,"HP OMEN Gaming Laptop, 16"" Full HD Display, AMD Ryzen 9 7940HS, 64 GB DDR5 RAM, 4 TB PCIe SSD, NVIDIA GeForce RTX 4070, Backlit Keyboard, Windows 11 Home, Shadow Black",,See All Buying Options
B0DN5RWNNC,HP Victus 16 Gaming Laptop,https://www.amazon.com/dp/B0DN5RWNNC?tag=hotproduct033-20,ok,no_buybox_offer,HP Victus 15.6 inch FHD 144Hz Gaming Laptop Intel Core i5-13420H NVIDIA GeForce RTX 4050 6GB - 16GB DDR4 512GB SSD Mica Silver (2024),,See All Buying Options
B0FP32XDWZ,ASUS ROG Strix SCAR 16 Laptop,https://www.amazon.com/dp/B0FP32XDWZ?tag=hotproduct033-20,ok,no_buybox_offer,"ASUS ROG Strix Scar 16 (2025) AI Gaming Laptop, 16"" 2.5K ROG Nebula HDR Mini LED 240Hz Display, Intel Core Ultra 9-275HX, GeForce RTX 5080 16GB, 64GB DDR5, 2TB PCIe SSD, Windows 11 Pro, w/USB Hub",,See All Buying Options
B0DLXSH2YB,Sonos Arc Ultra Soundbar,https://www.amazon.com/dp/B0DLXSH2YB?tag=hotproduct033-20,ok,no_buybox_offer,Sonos Arc Ultra soundbar + Sub 4 subwoofer - Black,,See All Buying Options
B08CGVTVMN,Vizio V-Series 5.1 Home Theater Soundbar,https://www.amazon.com/dp/B08CGVTVMN?tag=hotproduct033-20,ok,no_buybox_offer,"VIZIO V-Series 5.1 Home Theater Sound Bar with Dolby Audio, Bluetooth, Wireless Subwoofer, Voice Assistant Compatible, Includes Remote Control - V51x-J6",,See All Buying Options
B0B61ZKHXR,Denon AVR-X2800H 7.2ch AV Receiver,https://www.amazon.com/dp/B0B61ZKHXR?tag=hotproduct033-20,ok,no_buybox_offer,"Denon AVR-X1700H 7.2ch 8K Home Theater Receiver with 3D Audio, Voice Control, and HEOS Built-in (Renewed)",,See All Buying Options
B0FMGW1JC7,Marantz Cinema 60 Receiver,https://www.amazon.com/dp/B0FMGW1JC7?tag=hotproduct033-20,ok,no_buybox_offer,Marantz Cinema 60 7.2 Channel 8K Receiver Bundle with AudioQuest Sky 3m HDMI Cable,,See All Buying Options
B0CJZ57J4T,CyberPowerPC Gamer Xtreme RTX 4070,https://www.amazon.com/dp/B0CJZ57J4T?tag=hotproduct033-20,ok,no_buybox_offer,"CyberpowerPC Gamer Xtreme VR Gaming PC, Intel Core i9-14900KF 3.2GHz, GeForce RTX 4070 Ti 12GB, 32GB DDR5, 2TB NVMe SSD, WiFi Ready & Windows 11 Home (GXiVR8720A2)",,See All Buying Options
B0DTBR9P1Y,MSI MEG Aegis Ti5 Gaming Desktop,https://www.amazon.com/dp/B0DTBR9P1Y?tag=hotproduct033-20,ok,no_buybox_offer,"msi Aegis ZS2 Gaming Desktop: AMD R7-9800X3D, GeForce RTX 5080, 64GB DDR5, 2TB M.2 NVMe SSD, Liquid Cooling, 850W USB Type C, VR-Ready, Window 11 Home: C9NVV-1276US",,See All Buying Options
B0FM3PH3F2,NZXT Player 3 Gaming Desktop,https://www.amazon.com/dp/B0FM3PH3F2?tag=hotproduct033-20,ok,no_buybox_offer,"Skytech Gaming Azure 3 Gaming PC, AMD Ryzen 7 5700 3.7GHz, AMD RX 9060XT 8GB, 1TB NVMe SSD, 16GB DDR4 RAM 3200, 650W Gold PSU, Wi-Fi, Win 11, Gaming Desktop",,See All Buying Options
B091ZWD5BQ,Skytech Blaze 3.0 Gaming PC RTX 3060,https://www.amazon.com/dp/B091ZWD5BQ?tag=hotproduct033-20,ok,no_buybox_offer,"Skytech Shadow 3.0 Gaming PC Desktop - AMD Ryzen 5 3600 3.6GHz, RTX 3060 Ti 8GB GDDR6, 16GB DDR4 3200, 1TB NVMe SSD, 600W Gold PSU, RGB Fans, AC WiFi, Windows 10 Home 64-bit…",,See All Buying Options
B0FVQYBVGP,ASUS ROG Huracan G21CX Desktop,https://www.amazon.com/dp/B0FVQYBVGP?tag=hotproduct033-20,ok,no_buybox_offer,"ASUS ROG G700 (2025) Gaming Desktop PC, Intel® Core™ Ultra 7 265KF Processor, NVIDIA® GeForce RTX™ 5070, 1TB M.2 NVMe™ PCIe® 4 SSD, 32GB DDR5 RAM, Windows 11 Home, G700TF-MS776",,See All Buying Options
B09FYNM2GW,Thermaltake Glacier 360 Liquid Cooled PC,https://www.amazon.com/dp/B09FYNM2GW?tag=hotproduct033-20,ok,no_buybox_offer,"Thermaltake Glacier 360 Liquid-Cooled PC (AMD Ryzen 5 5600X, RTX 3060, 16GB 3600Mhz DDR4 ToughRAM RGB Memory, 1TB NVMe M.2, WiFi, Win 10 Home) Gaming Desktop Computer S3WT-B550-G36-LCS,White",,See All Buying Options
B0CQ53QFRT,HyperX Pulsefire Haste 2 Mouse,https://www.amazon.com/dp/B0CQ53QFRT?tag=hotproduct033-20,ok,no_buybox_offer,HyperX Pulsefire Haste 2 Mini – Wireless Gaming Mouse for PC Compact Lightweight Bluetooth 2.4GHz White,,See All Buying Options
B0B1W9WJZH,ROCCAT Kone Pro Air Wireless Mouse,https://www.amazon.com/dp/B0B1W9WJZH?tag=hotproduct033-20,ok,no_buybox_offer,"ROCCAT Kone Pro Air - Ergonomic Optical Performance Gaming Wireless Mouse, White, (ROC-11-415-02) (Renewed)",,See All Buying Options
B07HYXKWS9,SteelSeries QcK Prism XL Mouse Pad,https://www.amazon.com/dp/B07HYXKWS9?tag=hotproduct033-20,ok,no_buybox_offer,SteelSeries QcK Gaming Mouse Pad - XL RGB Prism Cloth - Sized to Cover Desks,,See All Buying Options
B09DTJBLXN,NZXT Capsule Mini USB Microphone,https://www.amazon.com/dp/B09DTJBLXN?tag=hotproduct033-20,ok,no_buybox_offer,NZXT Capsule - Cardioid USB Microphone - Matte White,,See All Buying Options
B0DVZ9D58R,Turtle Beach Stealth 600 Gen 3 Headset,https://www.amazon.com/dp/B0DVZ9D58R?tag=hotproduct033-20,ok,no_buybox_offer,"Turtle Beach Stealth 600 Xbox Purple Wireless Gaming Headset with 80 Hours Battery Life, 50 mm Speaker and Bluetooth for Xbox Series X|S, Xbox One, PC",,See All Buying Options
B0C6YLJGQP,Nacon RIG 600 Pro HS Wireless Headset,https://www.amazon.com/dp/B0C6YLJGQP?tag=hotproduct033-20,ok,no_buybox_offer,Nacon Rig 600 Pro Hs Gaming Headset One Size,,See All Buying Options
B0BQL6J6D2,JBL Quantum 910 Wireless Headset,https://www.amazon.com/dp/B0BQL6J6D2?tag=hotproduct033-20,ok,no_buybox_offer,"JBL Quantum 910 - Wireless Over-Ear Performance Gaming Headset with Head Tracking-Enhanced, Active Noise Cancelling and Bluetooth, JBL QuantumSPATIAL 360, Low Latency Wireless System (Black)",,See All Buying Options
B07ZQRNWDH,Sennheiser GSP 370 Wireless Headset,https://www.amazon.com/dp/B07ZQRNWDH?tag=hotproduct033-20,ok,no_buybox_offer,"Sennheiser GSP 302 Closed Back Gaming Headset for PC, Mac, PS4 and Xbox One - Black (Renewed)",,See All Buying Options
B085HNMHKJ,Holy Stone HS720E GPS Drone,https://www.amazon.com/dp/B085HNMHKJ?tag=hotproduct033-20,ok,no_buybox_offer,Holy Stone HS720E Drone with 4K Camera for Adults,,See All Buying Options
B0F1468WTK,iRobot Roomba j9+ Robot Vacuum,https://www.amazon.com/dp/B0F1468WTK?tag=hotproduct033-20,ok,no_buybox_offer,iRobot® Roomba® j9+ Self-Emptying Robot Vacuum - Certified Refurbished,,See All Buying Options
B0CDPJ2C94,Ecovacs DEEBOT X2 Robot Vacuum,https://www.amazon.com/dp/B0CDPJ2C94?tag=hotproduct033-20,ok,no_buybox_offer,"ECOVACS DEEBOT X2 Combo Robot Vacuum and Mop, 8700Pa Suction, 15mm Lift, Omni Station with Hot Water Mop Washing, Self-Emptying, Hot Air Drying, Auto-Refill, Obstacle Avoidance,Black",,See All Buying Options
B07RBBPD9S,Miele Complete C3 Cat & Dog Vacuum,https://www.amazon.com/dp/B07RBBPD9S?tag=hotproduct033-20,ok,no_buybox_offer,"Miele Complete C3 Excellence Vacuum, Lotus White",,See All Buying Options
B0GTK39HYY,Electrolux UltimateHome 900 Vacuum,https://www.amazon.com/dp/B0GTK39HYY?tag=hotproduct033-20,ok,no_buybox_offer,For Electrolux Replacement Mop Cloths for UltimateHome 900 and UltimateHome 700 Vacuum Cleaner Compatible with 8000,,See All Buying Options
B083JBZXYS,Eureka AirSpeed Ultra-Lightweight Vacuum,https://www.amazon.com/dp/B083JBZXYS?tag=hotproduct033-20,not_found,listing_removed,,,
B0C1SHGHSZ,Google Pixel Tablet,https://www.amazon.com/dp/B0C1SHGHSZ?tag=hotproduct033-20,ok,no_buybox_offer,"Google Pixel Tablet with Charging Speaker Dock - Android Tablet with 11-Inch Screen, Smart Home Controls, and Long-Lasting Battery - Hazel/Hazel - 128 GB, 2560x1600 Pixels",,See All Buying Options
B0FN5VQ5JK,ASUS PN53 Mini PC AMD Ryzen 9,https://www.amazon.com/dp/B0FN5VQ5JK?tag=hotproduct033-20,ok,no_buybox_offer,"ASUS PN52 Full System Mini PC with AMD Ryzen 7 5800H Processor, 8GB DDR4-3200MHz RAM, 512GB M.2 PCIE SSD, WiFi 6E, Bluetooth 5.2, 7 x USB, Windows 11 Pro, VESA Mount",,See All Buying Options
B0DBMRP8V1,Amazon Fire TV Stick HD,https://www.amazon.com/dp/B0DBMRP8V1?tag=hotproduct033-20,ok,no_buybox_offer,Amazon Fire TV Stick HD bundle with 2-Year Protection Plan,,See All Buying Options
B075SLGR9Z,TiVo Stream 4K Streaming Device,https://www.amazon.com/dp/B075SLGR9Z?tag=hotproduct033-20,not_found,listing_removed,,,
B0CKQ97Q7C,Xiaomi TV Box S 2nd Gen,https://www.amazon.com/dp/B0CKQ97Q7C?tag=hotproduct033-20,ok,no_buybox_offer,"Remote Control for Xiaomi TV Box S (2nd Gen) 4K,Replacement Remote Control for Mi Box S 2nd Gen with Bluetooth and Voice Remote Control",,See All Buying Options
B0G2BTYY58,Mecool KM2 Plus Android TV Box,https://www.amazon.com/dp/B0G2BTYY58?tag=hotproduct033-20,ok,no_buybox_offer,"Android TV Box 11.0, MECOOL KM2 Plus Deluxe Smart TV Box 4GB 32GB and Android 11.0 TV Box, MECOOL KM2 Plus 2GB 16GB Smart TV Box Bundle",,See All Buying Options
B0FMRXP1HP,Silk'n Flash&Go Hair Removal Device,https://www.amazon.com/dp/B0FMRXP1HP?tag=hotproduct033-20,not_found,listing_removed,,,
B00SR8Z74Q,Sisley Paris Black Rose Cream Mask,https://www.amazon.com/dp/B00SR8Z74Q?tag=hotproduct033-20,ok,no_buybox_offer,"Sisley Paris Black Rose Cream Mask - 60 mL - Instant Youth Face Mask to Smooth, Plump & Illuminate Skin",,See All Buying Options
B0C83MRDQS,Dior Capture Totale Super Potent Serum,https://www.amazon.com/dp/B0C83MRDQS?tag=hotproduct033-20,ok,no_buybox_offer,Dior Capture Totale Cell Energy Super Potent Le Serum Jumbo Size 2.5oz / 75mL,,See All Buying Options
B0CCPHGWR2,Pat McGrath Labs Skin Fetish Foundation,https://www.amazon.com/dp/B0CCPHGWR2?tag=hotproduct033-20,ok,no_buybox_offer,PAT McGRATH LABS Skin Fetish: Divine Powder Blush Electric Bloom,,See All Buying Options
B0FQ5J34GT,The Let Them Theory by Mel Robbins,https://www.amazon.com/dp/B0FQ5J34GT?tag=hotproduct033-20,not_found,listing_removed,,,
B075ZVNLTF,Fenty Beauty Pro Filt'r Soft Matte Foundation,https://www.amazon.com/dp/B075ZVNLTF?tag=hotproduct033-20,ok,no_buybox_offer,FENTY BEAUTY Pro Filt'r Soft Matte Longwear Foundation -150,,See All Buying Options
B0FL46N2YF,Urban Decay All Nighter Long-Lasting Makeup Setting Spray,https://www.amazon.com/dp/B0FL46N2YF?tag=hotproduct033-20,ok,no_buybox_offer,"Urban Decay All Nighter Setting Spray Duo Bundle - Full Size (4 Fl Oz) & Travel Size (1 Fl Oz) - Natural Finish - Waterproof Makeup Setting Spray - Smudge-Proof, Transfer-Resistant - Makeup Primer Set",,See All Buying Options
B01M5CZAXM,Anastasia Beverly Hills Brow Wiz Pencil,https://www.amazon.com/dp/B01M5CZAXM?tag=hotproduct033-20,ok,no_buybox_offer,"Anastasia Beverly Hills Brow Wiz - Ultra-Slim Retractable Eyebrow Pencil for Hair-Like Strokes, Natural Precision Definition, Longwear Waterproof Smudge-Proof for Filling & Shaping Brows",,See All Buying Options
B08PPVCCST,Steelcase Leap V2 Office Chair,https://www.amazon.com/dp/B08PPVCCST?tag=hotproduct033-20,ok,no_buybox_offer,"Steelcase Leap V2 Office Chair - Remanufactured by Crandall Office - Ergonomic, Fully Adjustable, 12-Year Warranty, Black Fabric - Premium Work & Home Office Seating",,See All Buying Options
B0G6ZX2MGW,Autonomous SmartDesk Pro,https://www.amazon.com/dp/B0G6ZX2MGW?tag=hotproduct033-20,ok,no_buybox_offer,"Autonomous Gray Electric Standing Desk 5 48×24 Inches, Adjustable Height Desk Stand Up Desk, Sit Stand 3 Memory Presets, Cable Tray for Home Office & Computer Workstation",,See All Buying Options
B0CNH22LKJ,Homall Gaming Chair Racing Style,https://www.amazon.com/dp/B0CNH22LKJ?tag=hotproduct033-20,ok,no_buybox_offer,Homall LED Gaming Massage Recliner Chair Racing Style Single Living Room Sofa Comfortable Ergonomic Home Theater Seating(Red),,See All Buying Options
B0C7S66CW5,Prepac Monterey Bookcase,https://www.amazon.com/dp/B0C7S66CW5?tag=hotproduct033-20,ok,no_buybox_offer,"Prepac Milo Mid-Century Modern Bookcase with Six Shelves, Two Doors, and Brushed Brass-Finished Knobs",,See All Buying Options
B0DV1TSSDV,Skullcandy Crusher Evo Wireless Headphones,https://www.amazon.com/dp/B0DV1TSSDV?tag=hotproduct033-20,ok,no_buybox_offer,Skullcandy Crusher EVO Wireless Noise-Isolating Over-Ear Headphones Bundle - Black,,See All Buying Options
B0B8TDQZ5K,Samsung Galaxy Buds2 Pro,https://www.amazon.com/dp/B0B8TDQZ5K?tag=hotproduct033-20,ok,no_buybox_offer,Samsung Galaxy Buds2 Pro True Wireless Bluetooth Earbud Headphones - White,,See All Buying Options
B08N69BKCX,Amazon Echo 4th Gen Smart Speaker,https://www.amazon.com/dp/B08N69BKCX?tag=hotproduct033-20,ok,no_buybox_offer,"Amazon Echo (newest model), Alexa speaker with premium sound, Ideal for large bedrooms, living rooms and kitchens, Charcoal",,See All Buying Options
B0C6PG4GR3,Ring Alarm 8-Piece Security Kit,https://www.amazon.com/dp/B0C6PG4GR3?tag=hotproduct033-20,ok,no_buybox_offer,Ring Alarm 8-Piece Kit with Ring Battery Doorbell Plus,,See All Buying Options
B08WRZJJGM,Lorex 4K Ultra HD IP Security System,https://www.amazon.com/dp/B08WRZJJGM?tag=hotproduct033-20,ok,no_buybox_offer,Lorex 4K Security Camera System Ultra HD IP 8-Channel 2TB NVR System with 8 POE Smart Deterrence 4K 8MP Indoor/Outdoor IP Cameras (Renewed),,See All Buying Options
B097KBD9NQ,Swann 8 Channel 4K DVR Security System,https://www.amazon.com/dp/B097KBD9NQ?tag=hotproduct033-20,ok,no_buybox_offer,8 Channel 4K Ultra HD DVR Security Recorder (Cameras Sold Separately) - SRDVR-85680W,,See All Buying Options
B0BWF4MQ8X,Garmin Forerunner 965 GPS Running Watch,https://www.amazon.com/dp/B0BWF4MQ8X?tag=hotproduct033-20,not_found,listing_removed,,,
B0CXN9K8LD,Fitbit Charge 6 Fitness Tracker,https://www.amazon.com/dp/B0CXN9K8LD?tag=hotproduct033-20,ok,no_buybox_offer,"Fitbit Charge 6 Fitness Tracker with Heart Rate, GPS, Obsidian",,See All Buying Options
B0DW728FT5,Bowflex SelectTech 552 Adjustable Dumbbells,https://www.amazon.com/dp/B0DW728FT5?tag=hotproduct033-20,ok,no_buybox_offer,Adjustable Dumbbell Handle - Replacement for Bowflex SelectTech 552 (Series 2) Adjustable Dumbbells,,See All Buying Options
B0DYJY82YM,HP EliteBook 840 G10 Business Laptop,https://www.amazon.com/dp/B0DYJY82YM?tag=hotproduct033-20,ok,no_buybox_offer,"HP EliteBook 840 G10 Business Laptop (14"" FHD+ Anti-Glare, Intel 10-Core i5-1335U (> i7-1255U), 32GB DDR5 RAM, 1TB SSD), 5MP Webcam, Backlit KB, Fingerprint, 2x Thunderbolt 4, Wi-Fi 6E, Win 11 Pro",,See All Buying Options
B0FL7BTYKX,Lenovo ThinkPad T14s Gen 4 AMD,https://www.amazon.com/dp/B0FL7BTYKX?tag=hotproduct033-20,ok,no_buybox_offer,"Lenovo ThinkPad T14s Gen 2 Laptop, 14"" FHD Notebook Computer, AMD Ryzen 5 PRO 5650U,16GB DDR4 RAM, 512GB SSD, HDMI, Thunderbolt 4, Windows 11 Pro (Renewed)",,See All Buying Options
B0C6PF997Q,Samsung Galaxy Book3 Pro 360,https://www.amazon.com/dp/B0C6PF997Q?tag=hotproduct033-20,not_found,listing_removed,,,
B09NJ8SJB9,Dell XPS 13 Plus Laptop,https://www.amazon.com/dp/B09NJ8SJB9?tag=hotproduct033-20,ok,no_buybox_offer,"Dell XPS 13 9310 Laptop (2020) | 13.4"" FHD+ | Core i7 - 512GB SSD - 16GB RAM | 4 Cores @ 5 GHz - 11th Gen CPU (Renewed)",,See All Buying Options
B0CD4KKF6K,Alienware AW3423DWF QD-OLED Monitor,https://www.amazon.com/dp/B0CD4KKF6K?tag=hotproduct033-20,ok,no_buybox_offer,Alienware AW3423DWF Curved QD-OLED Gaming Monitor 34-inch Quantum Dot OLED 0.1Ms 165Hz 21:9 Curved Display (Renewed),,See All Buying Options
B083GRVFXN,Gigabyte M32U 4K Gaming Monitor,https://www.amazon.com/dp/B083GRVFXN?tag=hotproduct033-20,ok,no_buybox_offer,"GIGABYTE M32U - 32"" IPS Gaming Monitor - UHD 3840x2160-144Hz - 1ms MPRT - AMD FreeSync Premium Pro - Type C KVM - HDMI, DP, Type C - Height Adjustable - Black (M32U-SA)",,See All Buying Options
B07RH9VRPT,Vitamix 5200 Professional Blender,https://www.amazon.com/dp/B07RH9VRPT?tag=hotproduct033-20,ok,no_buybox_offer,Vitamix 5200 5200 Countertop Blender 64 oz. Red (Renewed),,See All Buying Options
B0D4FJ5JSB,Blackstone 36 inch Outdoor Flat Top Griddle,https://www.amazon.com/dp/B0D4FJ5JSB?tag=hotproduct033-20,ok,unavailable,Blackstone 36 Inch Gas Griddle with Hood Cooking Station 4 Burner Flat Top Gas Grill Propane Fuelled Restaurant Grade Professional 36” Outdoor Griddle Station with Side Shelf,587.27,Temporarily out of stock. We are working hard to be back in stock. Place your order and we’ll email you when we have an estimated delivery date. You won’t be charged until the item ships.
B0B7VT42PK,Ninja DZ201 Foodi 8 Quart Air Fryer,https://www.amazon.com/dp/B0B7VT42PK?tag=hotproduct033-20,ok,no_buybox_offer,"Ninja DZ201 Foodi 6-in-1 2-Basket Air Fryer with DualZone Technology, 8-Quart Capacity -Dark Grey Stainless- (Renewed)",,See All Buying Options
B0727R431B,ChefSteps Joule Sous Vide,https://www.amazon.com/dp/B0727R431B?tag=hotproduct033-20,ok,no_buybox_offer,"ChefSteps 4186JW120B Joule Sous Vide, 1100 Watts, All White, 11 x 1.9 x 1.9""",,See All Buying Options
B09XB4ZD87,Cuisinart Coffee Center Grind & Brew Plus,https://www.amazon.com/dp/B09XB4ZD87?tag=hotproduct033-20,ok,no_buybox_offer,"Cuisinart SS-GB1 Coffee Center Grind and Brew Plus, Built-in Coffee Grinder, Coffeemaker and Single-Serve Brewer with HomeBarista Reusable Filter Cup, Black/Silver, 12-Cup",,See All Buying Options
B09JL9N6R7,Chamberlain myQ Smart Garage Control,https://www.amazon.com/dp/B09JL9N6R7?tag=hotproduct033-20,ok,no_buybox_offer,Chamberlain MYQ-G0401 myQ Wi-Fi Smart Garage Door Opener Control - Quantity 1,,See All Buying Options
B0DF86746T,OM System OM-1 Mark II Camera,https://www.amazon.com/dp/B0DF86746T?tag=hotproduct033-20,ok,no_buybox_offer,OM SYSTEM OM-1 Mark II Mirrorless Camera (Body Only) (Renewed),,See All Buying Options
B0G59XNHB9,Lowepro ProTactic 450 AW II Camera Bag,https://www.amazon.com/dp/B0G59XNHB9?tag=hotproduct033-20,ok,no_buybox_offer,"ProTactic BP 450 AW III 28L Camera Backpack, Black",,See All Buying Options
B0DNRPZTM8,K9 Ballistics Tough Bolster Dog Bed,https://www.amazon.com/dp/B0DNRPZTM8?tag=hotproduct033-20,ok,no_buybox_offer,"K9 Ballistics Tough Ripstop Round Bolster Dog Bed, Donut Shape, Scratch-Resistant, Machine Washable - Medium, Taupe Premium Finish",,See All Buying Options
B0DXSYTFY7,Lovevery Play Gym Baby Toy,https://www.amazon.com/dp/B0DXSYTFY7?tag=hotproduct033-20,not_found,listing_removed,,,
B0BZ7756C5,Brother MFC-J995DW INKvestment Tank Printer,https://www.amazon.com/dp/B0BZ7756C5?tag=hotproduct033-20,ok,no_buybox_offer,Brother MFC-J4335DW INKvestment Tank All-in-One Printer with Duplex and Wireless Printing Plus Up to 1-Year of Ink in-Box (Renewed Premium),,See All Buying Options
B009FFYIJA,Swingline GBC Fusion 1100L Laminator,https://www.amazon.com/dp/B009FFYIJA?tag=hotproduct033-20,ok,no_buybox_offer,"GBC Thermal Laminator Machine, Fusion 1100L, 9 Inch, 4 Min Warm-up, 3 or 5 Mil, with 10 EZUse Laminating Pouches (1703074)",,See All Buying Options
B0CS48D3NS,Garmin inReach Mini 2 Satellite Communicator,https://www.amazon.com/dp/B0CS48D3NS?tag=hotproduct033-20,ok,no_buybox_offer,"Garmin inReach® Messenger Handheld Satellite Communicator, Global Two-Way Messaging (Renewed)",,See All Buying Options
B0CTD455LJ,Sea to Summit Spark SP III Sleeping Bag,https://www.amazon.com/dp/B0CTD455LJ?tag=hotproduct033-20,ok,no_buybox_offer,Sea to Summit Spark Ultralight Down Sleeping Bag,,See All Buying Options
B0FTTZ9SPR,Patagonia Nano Puff Jacket,https://www.amazon.com/dp/B0FTTZ9SPR?tag=hotproduct033-20,ok,no_buybox_offer,Men's Nano Puff Jacket,,See All Buying Options
B08MMP4ZTN,Head Radical MP Tennis Racket,https://www.amazon.com/dp/B08MMP4ZTN?tag=hotproduct033-20,ok,no_buybox_offer,HEAD Radical MP G360+ Tennis Racquet,,See All Buying Options
B0FP3Q99XK,TaylorMade Stealth 2 Driver,https://www.amazon.com/dp/B0FP3Q99XK?tag=hotproduct033-20,ok,no_buybox_offer,Build a Custom TaylorMade Stealth 2 Plus 10.5* Driver,,See All Buying Options
B09TG9PQ8M,Yonex Arcsaber 11 Pro Badminton Racket,https://www.amazon.com/dp/B09TG9PQ8M?tag=hotproduct033-20,ok,no_buybox_offer,Yonex Arcsaber 11 PRO Badminton Racket (Grayish Pearl) (3UG5) (Unstrung),,See All Buying Options
B00CEYD72I,Nature Made Vitamin D3 2000 IU 260 Gummies,https://www.amazon.com/dp/B00CEYD72I?tag=hotproduct033-20,ok,no_buybox_offer,"Nature Made Vitamin D3 2000 IU Per Serving Gummies, Bone, Teeth, Muscle and Immune Health Support, 75 Day Supply, 150 Vitamin D Gummies for Adults",,See All Buying Options
B0739KKHWL,Nordic Naturals Ultimate Omega Fish Oil,https://www.amazon.com/dp/B0739KKHWL?tag=hotproduct033-20,ok,no_buybox_offer,"Nordic Naturals Ultimate Omega, Lemon Flavor - 90 Soft Gels - 1280 mg Omega-3 - High-Potency Omega-3 Fish Oil Supplement with EPA & DHA - Promotes Brain & Heart Health - Non-GMO - 45 Servings",,See All Buying Options
B0DV7JN7ZD,Theragun Mini 2nd Gen Percussive Massager,https://www.amazon.com/dp/B0DV7JN7ZD?tag=hotproduct033-20,ok,no_buybox_offer,"TheraGun Mini (3rd Generation) by Therabody – Ultra-Portable Massage Gun and Travel Essential for Fast, Effective Pain and Tension Relief Anywhere (Black)",,See All Buying Options
B07XVZ3D3Z,Samsonite GlobeTrotter Double Bill Organizer,https://www.amazon.com/dp/B07XVZ3D3Z?tag=hotproduct033-20,ok,no_buybox_offer,"Samsonite Pro Double Compartment Briefcase, Black, One Size",,See All Buying Options
B0DJRP7SKD,Samsung Galaxy Watch Ultra,https://www.amazon.com/dp/B0DJRP7SKD?tag=hotproduct033-20,ok,no_buybox_offer,Samsung Galaxy Watch Ultra (2024) 47mm LTE AI Smartwatch Titanium Gray with Black Band (Renewed),,See All Buying Options
B0CG9P8YFW,Withings ScanWatch 2 Hybrid Smartwatch,https://www.amazon.com/dp/B0CG9P8YFW?tag=hotproduct033-20,ok,no_buybox_offer,"WITHINGS ScanWatch 2 - Hybrid Smart Watch, Heart Rate Monitoring, Fitness Tracker, Cycle Tracker, Sleep Monitoring, GPS Tracker, 30-Day Battery Life, Android & Apple Compatible, HSA/FSA",,See All Buying Options
B08JHHYPZL,Makita XFD131 18V LXT Drill Driver Kit,https://www.amazon.com/dp/B08JHHYPZL?tag=hotproduct033-20,ok,no_buybox_offer,Makita XFD131-R 18V LXT Brushless Lithium-Ion 1/2 in. Cordless Drill/Driver Kit (3 Ah) (Renewed),,See All Buying Options
B0008G342C,DeWalt DW735X 13-inch Planer,https://www.amazon.com/dp/B0008G342C?tag=hotproduct033-20,ok,no_buybox_offer,DEWALT DW735R Heavy-Duty 15 Amp 13-Inch Benchtop Planer (Renewed),,See All Buying Options
