ASIN,Product Name,Amazon URL,HTTP Status,Reason,Title,Price,Availability
B0C6BQ8YW2,Ryobi PCL550B 18V One+ Reciprocating Saw,https://www.amazon.com/dp/B0C6BQ8YW2?tag=hotproduct033-20,ok,no_buybox_offer,"Cordless Reciprocating Saw Bundle - 18V Ryobi Reciprocating Saw Kit with (1) 4.0 Ah Battery and (1) 2.0 Ah Battery, 18-Volt Lithium-Ion Charger, and 16 Inch Buho Tool Bag",,See All Buying Options
B0BL8BN6LQ,Ryobi 18V ONE+ 4-Tool Combo Kit,https://www.amazon.com/dp/B0BL8BN6LQ?tag=hotproduct033-20,ok,no_buybox_offer,18V Brushless 6-Tool Combo Kit,,See All Buying Options
B0000DD25P,Grizzly Industrial G0715P Combo Lathe,https://www.amazon.com/dp/B0000DD25P?tag=hotproduct033-20,ok,no_buybox_offer,"Grizzly Industrial G4015Z - 19-3/16"" 3/4 HP Combo Lathe/Mill",,See All Buying Options
B07FPZVK43,NewAge Products Pro 3.0 Series Cabinet Set 9-Piece,https://www.amazon.com/dp/B07FPZVK43?tag=hotproduct033-20,ok,no_buybox_offer,"NewAge Products Bold Series Gray 9 Piece Set, Garage Cabinets, 50525",,See All Buying Options
B07DM8DG1B,FLIR One Pro LT Thermal Imaging Camera,https://www.amazon.com/dp/B07DM8DG1B?tag=hotproduct033-20,ok,no_buybox_offer,FLIR ONE Pro LT - High resolution Thermal Imaging Camera for iOS Smartphones (iPhone w/Lightning Port Only),,See All Buying Options
B0D9NJ9BV5,Nest Protect Smoke Carbon Monoxide Detector 2-Pack,https://www.amazon.com/dp/B0D9NJ9BV5?tag=hotproduct033-20,not_found,listing_removed,,,
B0FFD36Z96,Rheem PROPH80 T2 RH80 Prestige Smart Electric Heater,https://www.amazon.com/dp/B0FFD36Z96?tag=hotproduct033-20,ok,no_buybox_offer,Rheem 50 Gal. Smart High Efficiency Hybrid Heat Pump Water Heater with 10-Year Warranty,,See All Buying Options
B0GHLWFVL3,Yamaha P-515 88-Key Digital Piano,https://www.amazon.com/dp/B0GHLWFVL3?tag=hotproduct033-20,ok,no_buybox_offer,"88 Key Piano Keyboard, Semi Weighted Electronic Digital Pia",,See All Buying Options
B07GY8D3KW,Native Instruments Komplete Kontrol A49 MIDI Keyboard,https://www.amazon.com/dp/B07GY8D3KW?tag=hotproduct033-20,ok,no_buybox_offer,Native Instruments Komplete Kontrol A49 Controller Keyboard (25237),,See All Buying Options
B007E22C2G,Fiskars 36-Inch Long-Handled Bypass Lopper,https://www.amazon.com/dp/B007E22C2G?tag=hotproduct033-20,ok,no_buybox_offer,"Fiskars Loppers for Tree Trimming, Heavy Duty, with Extendable Handle (24.5""-37"" Range), Sharp Bypass Steel Blade Tree Branch Cutter up to 1.5-Inch Diameter Cut Capacity",,See All Buying Options
B004RUH8TA,Orbit 21-Piece Drip Irrigation Kit,https://www.amazon.com/dp/B004RUH8TA?tag=hotproduct033-20,ok,no_buybox_offer,"Orbit 67431 1/4"" Barb 30-Piece Drip Irrigation, Drip Fitting Assortment, 10 Couplings, 10 Plugs, 5 Tees, and 5 Elbows",,See All Buying Options
B0FL2F3W34,Autonomous ErgoChair Pro+ Office Chair,https://www.amazon.com/dp/B0FL2F3W34?tag=hotproduct033-20,ok,no_buybox_offer,"AUTONOMOUS ErgoChair Pro Black Foam Ergonomic Office Chair For Back Pain Relief Adjustable Lumbar Support, Headrest, Big And Tall Home Office Desk Chair Comfy 300 LBS with Swivel Wheels For Long Hours",,See All Buying Options
B08FCV5YSS,Victrix Gambit Dual Core Esports Headset,https://www.amazon.com/dp/B08FCV5YSS?tag=hotproduct033-20,ok,no_buybox_offer,"Victrix Gambit World's Fastest Licensed Xbox Controller, Elite Esports Design with Swappable Pro Thumbsticks, Custom Paddles, Swappable White / Purple Faceplate for Xbox One, Series X/S, PC",,See All Buying Options
B0C3QS9P42,HyperX Cloud Stinger 2 Wireless Headset,https://www.amazon.com/dp/B0C3QS9P42?tag=hotproduct033-20,ok,no_buybox_offer,"HyperX Cloud Stinger 2 - Wireless Gaming Headset – Compatible with PC. Noise-Cancelling Swivel-to-Mute Microphone, Comfortable Memory Foam, UP to 20 Hours of Battery Life (Renewed) - Grade A",,See All Buying Options
B0FB9HGFQV,Google Nest Hub 3rd Gen,https://www.amazon.com/dp/B0FB9HGFQV?tag=hotproduct033-20,ok,no_buybox_offer,"Google Nest Hub (2nd Gen) 7-inch Display, 2nd Generation, GA01331-INTL (Renewed)",,See All Buying Options
B0G27G6MLR,Samsung Galaxy Tab S6 Lite 2024,https://www.amazon.com/dp/B0G27G6MLR?tag=hotproduct033-20,ok,no_buybox_offer,"SAMSUNG Galaxy Tab S6 Lite 10.4"" 64GB (2024 Model - International Version) WiFi Android Tablet with S Pen (Mint) (Renewed)",,See All Buying Options
B0C2LSGXR1,TCL Tab 10 FHD Tablet,https://www.amazon.com/dp/B0C2LSGXR1?tag=hotproduct033-20,ok,no_buybox_offer,"TCL Tablet (Renewed) (Tab Pro 5G (10.4"" | Verizon))",,See All Buying Options
B0CK3L9WD3,Raspberry Pi 5 8GB Mini Computer,https://www.amazon.com/dp/B0CK3L9WD3?tag=hotproduct033-20,ok,no_buybox_offer,Raspberry Pi 5 4GB,,See All Buying Options
B0G6JVPH73,Geniatech MyGica ATV1960 Android TV Box,https://www.amazon.com/dp/B0G6JVPH73?tag=hotproduct033-20,ok,no_buybox_offer,"Android TV Box 4GB RAM 32GB, Smart TV Box Android 4K Ultra HD, 2.4G/5G Dual-Band WiFi 6, Support 100M Ethernet, Bluetooth 5.0, USB 2.0, for Home Theater",,See All Buying Options
B0G6JVPH73,MATRICOM G-Box Q4 Android TV Box,https://www.amazon.com/dp/B0G6JVPH73?tag=hotproduct033-20,ok,no_buybox_offer,"Android TV Box 4GB RAM 32GB, Smart TV Box Android 4K Ultra HD, 2.4G/5G Dual-Band WiFi 6, Support 100M Ethernet, Bluetooth 5.0, USB 2.0, for Home Theater",,See All Buying Options
B07DXLSMBC,WD Elements SE 2TB Streaming Hard Drive,https://www.amazon.com/dp/B07DXLSMBC?tag=hotproduct033-20,ok,no_buybox_offer,WD 2TB Elements Portable External Hard Drive - USB 3.0 - WDBU6Y0020BBK-WESN (Renewed),,See All Buying Options
B08YF4LNDQ,By Terry HYALURONIC GLOBAL FACE CREAM,https://www.amazon.com/dp/B08YF4LNDQ?tag=hotproduct033-20,ok,no_buybox_offer,Hyaluronic Global Face Cream by By Terry for Women - 1.69 oz Cream,,See All Buying Options
B0CNKYW5ZT,The Creative Act by Rick Rubin,https://www.amazon.com/dp/B0CNKYW5ZT?tag=hotproduct033-20,not_found,listing_removed,,,
B0F5JVLB11,Keurig K-Supreme Plus Smart Coffee Maker,https://www.amazon.com/dp/B0F5JVLB11?tag=hotproduct033-20,ok,no_buybox_offer,"Keurig K-Supreme Single Serve K-Cup Pod Coffee Maker, MultiStream Technology, 4 Brew Sizes, 66oz Dual-Position Removable Reservoir, Black (Renewed)",,See All Buying Options
B07QNM7YDM,Roomba 694 Robot Vacuum Wi-Fi Connected,https://www.amazon.com/dp/B07QNM7YDM?tag=hotproduct033-20,ok,no_buybox_offer,"iRobot Roomba E5 (5150) Robot Vacuum - Wi-Fi Connected, Works with Alexa, Ideal for Pet Hair, Carpets, Hard, Self-Charging Robotic Vacuum, Black",,See All Buying Options
B072YVWBXH,Aquasonic Black Series Ultra Whitening Toothbrush – ADA Accepted Electric Toothbrush- 8 Brush Heads & Travel Case –,https://www.amazon.com/dp/B072YVWBXH?tag=hotproduct033-20,ok,no_buybox_offer,"Aquasonic Black Series Ultra Whitening Toothbrush – ADA Accepted Electric Toothbrush- 8 Brush Heads & Travel Case – 40,000 VPM Electric Motor & Wireless Charging - 4 Modes w Smart Timer",,See All Buying Options
B0FJKZGF9P,"SHAN ZU 16 Pieces Knife Set, Knife Block Set in Powder Steel",https://www.amazon.com/dp/B0FJKZGF9P?tag=hotproduct033-20,ok,no_buybox_offer,"SHAN ZU 16 Pieces Knife Set, Knife Block Set in Powder Steel, Ultra Sharp Kitchen Knives Set, High Hardness Japanese Knife Set with Ergonomic Pakkawood Handle, Chef Knives Set for Kitchen Cooking",,See All Buying Options
B0GQXTQX97,"RoowLtne Retinol Serum for Face & Neck,Anti Aging Face Serum with Collagen & Boost Hydration Formula,Targets Wrinkles",https://www.amazon.com/dp/B0GQXTQX97?tag=hotproduct033-20,not_found,listing_removed,,,
B0F9S5NFJT,Sony ULT Field 7 Speaker,https://www.amazon.com/dp/B0F9S5NFJT?tag=hotproduct033-20,ok,no_buybox_offer,Sony ULT Field 7 Wireless Portable Bluetooth Karaoke Party Speaker (Renewed Premium),,See All Buying Options
B0DD2ZB3DZ,Dell SE2726HG Monitor,https://www.amazon.com/dp/B0DD2ZB3DZ?tag=hotproduct033-20,ok,suspicious_price,"INNOCN 49"" Curved Monitor Ultrawide Gaming 5K2K 120Hz 32:9 QHD 5120 x 1440P Computer Monitor, R1800, 99% sRGB, HDR400, USB Type C, DisplayPort, HDMI, Built-in Speakers, Height/Tilt Adjustable - 49C1R",722.49,In Stock
B07GG3XXNX,Ring Video Doorbell Pro 2,https://www.amazon.com/dp/B07GG3XXNX?tag=hotproduct033-20,blocked,scrape_blocked,,,
B0D96TXTM9,Nikon Z9 Camera,https://www.amazon.com/dp/B0D96TXTM9?tag=hotproduct033-20,not_found,listing_removed,,,
B01K31X4HG,Herman Miller Aeron Chair,https://www.amazon.com/dp/B01K31X4HG?tag=hotproduct033-20,ok,no_buybox_offer,Herman Miller Aeron Chair Size B Fully Loaded Posture Fit,,See All Buying Options
B0CH8ZT8Y1,Profoto B10 Plus Head,https://www.amazon.com/dp/B0CH8ZT8Y1?tag=hotproduct033-20,blocked,scrape_blocked,,,
B09QF4TSZF,"Leica M11 Monochrom Digital Rangefinder Camera, Black",https://www.amazon.com/dp/B09QF4TSZF?tag=hotproduct033-20,ok,no_buybox_offer,Leica M11 Digital Rangefinder Camera (Black),,See All Buying Options
B0F59K7M9N,Zeiss Otus 85mm f/1.4,https://www.amazon.com/dp/B0F59K7M9N?tag=hotproduct033-20,blocked,scrape_blocked,,,
B0DXMXY3SC,Samsung Neo QLED TV 55,https://www.amazon.com/dp/B0DXMXY3SC?tag=hotproduct033-20,ok,unavailable,"Samsung 55-Inch Class Neo QLED QN70F 4K Mini LED Smart TV (2025 Model) NQ4 AI Gen2 Processor, Quantum Matrix Technology Slim, Motion Xcelerator 144Hz, Samsung Vision AI, Alexa Built-in",615.59,Temporarily out of stock. We are working hard to be back in stock. Place your order and we’ll email you when we have an estimated delivery date. You won’t be charged until the item ships.
B0BDGJ24QQ,GoPro Hero11 Black,https://www.amazon.com/dp/B0BDGJ24QQ?tag=hotproduct033-20,ok,no_buybox_offer,"GoPro HERO11 (Hero 11) Black - Waterproof Action Camera with 5.3K Video, 27MP Photos, 1/1.9"" Sensor, Live Streaming, Webcam, Stabilization + 64GB Card, 50 Piece Accessory Kit and 2 Extra Batteries",,See All Buying Options
B0CKRYL4X4,Samsung Galaxy Tab S9 Ultra,https://www.amazon.com/dp/B0CKRYL4X4?tag=hotproduct033-20,ok,no_buybox_offer,Samsung Galaxy Tab S9 Ultra (Wifi) SM-X910 WIFI 512GB Graphite (Renewed),,See All Buying Options
B0G6T4VVDC,Lenovo Yoga 9i,https://www.amazon.com/dp/B0G6T4VVDC?tag=hotproduct033-20,ok,no_buybox_offer,"NIMO 17.3"" FHD IPS Laptop, Intel Core i3-1215U (Beats i5-1135G7 Class), 16GB RAM, 512GB SSD, Windows 11 Home, Wi-Fi 6, Backlit Keyboard, Fingerprint, USB-C 65W Fast Charge, Bluetooth 5.2, 180° View",,See All Buying Options
B0CZ1RTYQY,Dell UltraSharp 32 Monitor,https://www.amazon.com/dp/B0CZ1RTYQY?tag=hotproduct033-20,ok,no_buybox_offer,"Dell S2425HS Monitor - 23.8 Inch, FHD (1920x1080) Display, 100Hz Refresh Rate 1500:1 Contrast Ratio, TÜV Rheinland Eye Comfort 4 Star, Integrated 2x5W Speaker, Height/Tilt/Swivel/Pivot - Ash White",,See All Buying Options
B0CS6LM24Z,Sony A7S III,https://www.amazon.com/dp/B0CS6LM24Z?tag=hotproduct033-20,blocked,scrape_blocked,,,
B0FLL5V2K7,Arlo Ultra 2 Plus,https://www.amazon.com/dp/B0FLL5V2K7?tag=hotproduct033-20,ok,suspicious_price,"Arlo Ultra (3rd Gen - 2025 Release) 4K Security Camera + SmartHub, Battery Power, Emergency Response, AI Summary, 1-Month Trial of Secure Plan, 180° Field of View, 3 Cam, White, Motion Alert",449.99,Only 3 left in stock (more on the way).
B09SZ1LC36,Cuisinart Chef's Knife Set,https://www.amazon.com/dp/B09SZ1LC36?tag=hotproduct033-20,ok,suspicious_price,"PAUDIN Knife Set, 5PCS Kitchen Knife Set without Block, Stainless Steel Chef Knife Set with Pakkawood Handle, Professional Kitchen Gift Sets for Cooking Lovers & Farther's Day",139.99,In Stock
B09DR9K8XB,"AMOREPACIFIC Treatment Enzyme Peel Cleansing Powder | Korean Gentle Daily Exfoliator with Hyaluronic Acid and Green Tea Enzymes, 1.9 oz.",https://www.amazon.com/dp/B09DR9K8XB?tag=hotproduct033-20,blocked,scrape_blocked,,,
B00BETY3O0,AMOREPACIFIC Color Control Cushion Compact Broad Spectrum SPF 50+ | Korean Foundation with Buildable Coverage & Dewy Finish,https://www.amazon.com/dp/B00BETY3O0?tag=hotproduct033-20,blocked,scrape_blocked,,,
B09QXHK528,"Clé de Peau Beauté, Concealer SPF 27",https://www.amazon.com/dp/B09QXHK528?tag=hotproduct033-20,blocked,scrape_blocked,,,
149263817X,How to Catch the Easter Bunny,https://www.amazon.com/dp/149263817X?tag=hotproduct033-20,ok,suspicious_price,How to Catch the Easter Bunny,10.99,
B09MTW9M8Y,Eufy by Anker RoboVac X8 Pro Robot Vacuum,https://www.amazon.com/dp/B09MTW9M8Y?tag=hotproduct033-20,suspect,scrape_suspect,,,
B0DLBTPDCS,Apple Mac Mini M4 (2024),https://www.amazon.com/dp/B0DLBTPDCS?tag=hotproduct033-20,ok,no_buybox_offer,"Apple 2024 Mac mini Desktop Computer with M4 chip with 10‑core CPU and 10‑core GPU: Built for Apple Intelligence, 16GB Unified Memory, 256GB SSD Storage, Gigabit Ethernet. Works with iPhone/iPad",,See All Buying Options
B0D1SNZCG9,"La Mer Moisturizing Fresh Cream 1 Oz, White",https://www.amazon.com/dp/B0D1SNZCG9?tag=hotproduct033-20,ok,no_buybox_offer,"La Mer Moisturizing Fresh Cream 1 Oz, White",,See All Buying Options
B0F323N949,Alienware m18 R2 Gaming Laptop,https://www.amazon.com/dp/B0F323N949?tag=hotproduct033-20,ok,no_buybox_offer,"Dell Alienware M18 R2 Gaming Laptop, NVIDIA RTX 4090 16GB GDDR6, Intel i9 14900HX, 18"" 2.5K QHD+ (2560x1600) 165Hz 3ms, 64 GB DDR5, 2 TB SSD, WiFi 7, Bluetooth 5.4, Windows 11 Pro",,See All Buying Options
B0CS64LL89,HP OMEN 16 Gaming Laptop RTX 4070,https://www.amazon.com/dp/B0CS64LL89?tag=hotproduct033-20,ok,no_buybox_offer,"HP OMEN Gaming Laptop, 16"" Full HD Display, AMD Ryzen 9 7940HS, 64 GB DDR5 RAM, 4 TB PCIe SSD, NVIDIA GeForce RTX 4070, Backlit Keyboard, Windows 11 Home, Shadow Black",,See All Buying Options
B0DN5RWNNC,HP Victus 16 Gaming Laptop,https://www.amazon.com/dp/B0DN5RWNNC?tag=hotproduct033-20,ok,no_buybox_offer,HP Victus 15.6 inch FHD 144Hz Gaming Laptop Intel Core i5-13420H NVIDIA GeForce RTX 4050 6GB - 16GB DDR4 512GB SSD Mica Silver (2024),,See All Buying Options
B0FP32XDWZ,ASUS ROG Strix SCAR 16 Laptop,https://www.amazon.com/dp/B0FP32XDWZ?tag=hotproduct033-20,ok,no_buybox_offer,"ASUS ROG Strix Scar 16 (2025) AI Gaming Laptop, 16"" 2.5K ROG Nebula HDR Mini LED 240Hz Display, Intel Core Ultra 9-275HX, GeForce RTX 5080 16GB, 64GB DDR5, 2TB PCIe SSD, Windows 11 Pro, w/USB Hub",,See All Buying Options
B0BQZHLNZN,Corsair Voyager a1600 Laptop,https://www.amazon.com/dp/B0BQZHLNZN?tag=hotproduct033-20,blocked,scrape_blocked,,,
B0DLXSH2YB,Sonos Arc Ultra Soundbar,https://www.amazon.com/dp/B0DLXSH2YB?tag=hotproduct033-20,ok,no_buybox_offer,Sonos Arc Ultra soundbar + Sub 4 subwoofer - Black,,See All Buying Options
B0B61ZKHXR,Denon AVR-X2800H 7.2ch AV Receiver,https://www.amazon.com/dp/B0B61ZKHXR?tag=hotproduct033-20,ok,no_buybox_offer,"Denon AVR-X1700H 7.2ch 8K Home Theater Receiver with 3D Audio, Voice Control, and HEOS Built-in (Renewed)",,See All Buying Options
B0FMGW1JC7,Marantz Cinema 60 Receiver,https://www.amazon.com/dp/B0FMGW1JC7?tag=hotproduct033-20,ok,no_buybox_offer,Marantz Cinema 60 7.2 Channel 8K Receiver Bundle with AudioQuest Sky 3m HDMI Cable,,See All Buying Options
B07B4Q5587,ELAC Debut 2.0 B6.2 Bookshelf Speakers,https://www.amazon.com/dp/B07B4Q5587?tag=hotproduct033-20,ok,suspicious_price,"ELAC Debut 2.0 B6.2 Bookshelf Speakers, Black (Pair) - 1” Cloth Dome Tweeter & 6.5” Aramid Fiber Woofer - 2-Way Bass Reflex - Up to 35,000 Hz Response",329.0,In Stock
B0GR5BZGHS,HP Omen 45L RTX 5080 Gaming Desktop,https://www.amazon.com/dp/B0GR5BZGHS?tag=hotproduct033-20,ok,no_buybox_offer,"HP OMEN 45L Gaming 5090 Desktop PC, Intel Core Ultra 9 285K, GeForce RTX 5090, 64GB DDR5, 2TB SSD, Support 4-Display 4K, Light Studio, HDMI, DP, Wi-Fi 6E, Windows 11 Pro, AI-Ready Workstation Desktop",,See All Buying Options
B0CJZ57J4T,CyberPowerPC Gamer Xtreme RTX 4070,https://www.amazon.com/dp/B0CJZ57J4T?tag=hotproduct033-20,ok,no_buybox_offer,"CyberpowerPC Gamer Xtreme VR Gaming PC, Intel Core i9-14900KF 3.2GHz, GeForce RTX 4070 Ti 12GB, 32GB DDR5, 2TB NVMe SSD, WiFi Ready & Windows 11 Home (GXiVR8720A2)",,See All Buying Options
B0DTBR9P1Y,MSI MEG Aegis Ti5 Gaming Desktop,https://www.amazon.com/dp/B0DTBR9P1Y?tag=hotproduct033-20,ok,no_buybox_offer,"msi Aegis ZS2 Gaming Desktop: AMD R7-9800X3D, GeForce RTX 5080, 64GB DDR5, 2TB M.2 NVMe SSD, Liquid Cooling, 850W USB Type C, VR-Ready, Window 11 Home: C9NVV-1276US",,See All Buying Options
B0FM3PH3F2,NZXT Player 3 Gaming Desktop,https://www.amazon.com/dp/B0FM3PH3F2?tag=hotproduct033-20,ok,no_buybox_offer,"Skytech Gaming Azure 3 Gaming PC, AMD Ryzen 7 5700 3.7GHz, AMD RX 9060XT 8GB, 1TB NVMe SSD, 16GB DDR4 RAM 3200, 650W Gold PSU, Wi-Fi, Win 11, Gaming Desktop",,See All Buying Options
B0GBSRFZ52,Periphio Vortex Gaming Desktop RTX 4060 Ti,https://www.amazon.com/dp/B0GBSRFZ52?tag=hotproduct033-20,ok,suspicious_price,"Gaming PC Desktop Computer - Ryzen 5 4500, Radeon RX 6500XT 4GB, 16GB DDR4 RAM, 512GB NVME SSD, Prebuilt Tower for 1080P Casual Gaming, Streaming, School & Home Office (White)",749.99,In Stock
B091ZWD5BQ,Skytech Blaze 3.0 Gaming PC RTX 3060,https://www.amazon.com/dp/B091ZWD5BQ?tag=hotproduct033-20,ok,no_buybox_offer,"Skytech Shadow 3.0 Gaming PC Desktop - AMD Ryzen 5 3600 3.6GHz, RTX 3060 Ti 8GB GDDR6, 16GB DDR4 3200, 1TB NVMe SSD, 600W Gold PSU, RGB Fans, AC WiFi, Windows 10 Home 64-bit…",,See All Buying Options
B07X6BR5W3,Dell G5 Gaming Desktop,https://www.amazon.com/dp/B07X6BR5W3?tag=hotproduct033-20,ok,suspicious_price,"Dell G5 Gaming Desktop, Intel Core i7-9700, NVIDIA GeForce RTX 2060 6GB GDDR6, 512GB SSD Storage, 16GB RAM, i5090-7166GRY-PUS",1499.0,Only 1 left in stock - order soon.
B0GT22W9BD,Alienware Area-51 Gaming Desktop,https://www.amazon.com/dp/B0GT22W9BD?tag=hotproduct033-20,blocked,scrape_blocked,,,
B09FYNM2GW,Thermaltake Glacier 360 Liquid Cooled PC,https://www.amazon.com/dp/B09FYNM2GW?tag=hotproduct033-20,ok,no_buybox_offer,"Thermaltake Glacier 360 Liquid-Cooled PC (AMD Ryzen 5 5600X, RTX 3060, 16GB 3600Mhz DDR4 ToughRAM RGB Memory, 1TB NVMe M.2, WiFi, Win 10 Home) Gaming Desktop Computer S3WT-B550-G36-LCS,White",,See All Buying Options
B0D1SCV5WR,SteelSeries Arctis Nova Pro Wireless,https://www.amazon.com/dp/B0D1SCV5WR?tag=hotproduct033-20,ok,suspicious_price,"SteelSeries Arctis Nova Pro Wireless Multi-System Gaming Headset — Neodymium Magnetic Drivers — Active Noise Cancellation — 2 Battery System — ClearCast Gen 2 Mic — PC, PS5, PS4, Switch, Mobile",379.99,In Stock
B0BF67DM6K,SteelSeries Apex Pro TKL Keyboard,https://www.amazon.com/dp/B0BF67DM6K?tag=hotproduct033-20,ok,no_buybox_offer,SteelSeries Apex Pro TKL Wireless HyperMagnetic Gaming Keyboard — Esports Tenkeyless — OLED Screen — Adjustable Actuation — PBT Keycaps — Bluetooth — 2.4GHz — USB-C,,See All Buying Options
B09963YS4P,Glorious GMMK Pro Gaming Keyboard,https://www.amazon.com/dp/B09963YS4P?tag=hotproduct033-20,ok,suspicious_price,"GLORIOUS Gaming GMMK PRO 75% Barebones Black (Frame Only) - Modular Mechanical Gaming Keyboard, TKL Size (75%), 3.3lb Frame, RGB, Fully Customisable, 5-Pin Switch Support",79.99,In Stock
B0CQ53QFRT,HyperX Pulsefire Haste 2 Mouse,https://www.amazon.com/dp/B0CQ53QFRT?tag=hotproduct033-20,ok,no_buybox_offer,HyperX Pulsefire Haste 2 Mini – Wireless Gaming Mouse for PC Compact Lightweight Bluetooth 2.4GHz White,,See All Buying Options
B0B1W9WJZH,ROCCAT Kone Pro Air Wireless Mouse,https://www.amazon.com/dp/B0B1W9WJZH?tag=hotproduct033-20,ok,no_buybox_offer,"ROCCAT Kone Pro Air - Ergonomic Optical Performance Gaming Wireless Mouse, White, (ROC-11-415-02) (Renewed)",,See All Buying Options
B08QSNNV5H,Corsair MM700 RGB Extended Mouse Pad,https://www.amazon.com/dp/B08QSNNV5H?tag=hotproduct033-20,ok,suspicious_price,"Corsair MM700 RGB Extended Cloth Gaming Mouse Pad - 36.6"" x 15.8"" - 360° RGB Lighting - Two USB Port Hub - Thick Rubber - Black",59.99,In Stock
B07HYXKWS9,SteelSeries QcK Prism XL Mouse Pad,https://www.amazon.com/dp/B07HYXKWS9?tag=hotproduct033-20,ok,no_buybox_offer,SteelSeries QcK Gaming Mouse Pad - XL RGB Prism Cloth - Sized to Cover Desks,,See All Buying Options
B09DTJBLXN,NZXT Capsule Mini USB Microphone,https://www.amazon.com/dp/B09DTJBLXN?tag=hotproduct033-20,ok,no_buybox_offer,NZXT Capsule - Cardioid USB Microphone - Matte White,,See All Buying Options
B0DSLZF8HB,Astro A50 X Wireless Headset,https://www.amazon.com/dp/B0DSLZF8HB?tag=hotproduct033-20,blocked,scrape_blocked,,,
B0CKFFP3HF,EPOS H6Pro Wired Gaming Headset,https://www.amazon.com/dp/B0CKFFP3HF?tag=hotproduct033-20,ok,suspicious_price,"EPOS H6PRO Xbox Edition Headphones | Wired Open Acoustic Gaming Headset| These Gaming Headphones Include Cables for PC, Mac, PS5™, PS4™, Series X, Xbox One, and Nintendo Switch™",78.99,In Stock
B0C6YLJGQP,Nacon RIG 600 Pro HS Wireless Headset,https://www.amazon.com/dp/B0C6YLJGQP?tag=hotproduct033-20,ok,no_buybox_offer,Nacon Rig 600 Pro Hs Gaming Headset One Size,,See All Buying Options
B0CBG4VQ71,Plantronics RIG 800LX Wireless Headset,https://www.amazon.com/dp/B0CBG4VQ71?tag=hotproduct033-20,blocked,scrape_blocked,,,
B0BHZX3TYV,Amazon Echo Show 15 Smart Display,https://www.amazon.com/dp/B0BHZX3TYV?tag=hotproduct033-20,ok,no_buybox_offer,"Echo Show 15 | Full HD 15.6"" smart display with Alexa and Fire TV built in | Remote included",,See All Buying Options
B0CQ24XLMZ,JBL Link View Smart Display,https://www.amazon.com/dp/B0CQ24XLMZ?tag=hotproduct033-20,ok,no_live_price,PRO HDMI 8K/4k [2Pack] Adapter Compatible with JBL Link View USB Type-C/Thunderbolt 3/4 Converter Smart Full Digital 4320p @60Hz Display,,
B07W7LW3VJ,Logi Dock Flex Video Bar Smart Display,https://www.amazon.com/dp/B07W7LW3VJ?tag=hotproduct033-20,ok,suspicious_price,Logitech Rally Display Hub - Video conferencing device,219.99,Only 16 left in stock - order soon.
B085HNMHKJ,Holy Stone HS720E GPS Drone,https://www.amazon.com/dp/B085HNMHKJ?tag=hotproduct033-20,ok,no_buybox_offer,Holy Stone HS720E Drone with 4K Camera for Adults,,See All Buying Options
B0F1468WTK,iRobot Roomba j9+ Robot Vacuum,https://www.amazon.com/dp/B0F1468WTK?tag=hotproduct033-20,ok,no_buybox_offer,iRobot® Roomba® j9+ Self-Emptying Robot Vacuum - Certified Refurbished,,See All Buying Options
B0CDPJ2C94,Ecovacs DEEBOT X2 Robot Vacuum,https://www.amazon.com/dp/B0CDPJ2C94?tag=hotproduct033-20,ok,no_buybox_offer,"ECOVACS DEEBOT X2 Combo Robot Vacuum and Mop, 8700Pa Suction, 15mm Lift, Omni Station with Hot Water Mop Washing, Self-Emptying, Hot Air Drying, Auto-Refill, Obstacle Avoidance,Black",,See All Buying Options
B07RBBPD9S,Miele Complete C3 Cat & Dog Vacuum,https://www.amazon.com/dp/B07RBBPD9S?tag=hotproduct033-20,ok,no_buybox_offer,"Miele Complete C3 Excellence Vacuum, Lotus White",,See All Buying Options
B0B6BKPRG3,LG CordZero A9 Kompressor Vacuum,https://www.amazon.com/dp/B0B6BKPRG3?tag=hotproduct033-20,ok,suspicious_price,"LG CordZero Vacuum, Matte Black (Renewed)",239.99,In Stock
B0C1QHF68W,Hoover ONEPWR Evolve Pet Cordless Vacuum,https://www.amazon.com/dp/B0C1QHF68W?tag=hotproduct033-20,ok,suspicious_price,"Hoover ONEPWR Evolve Pet Cordless Vacuum Cleaner, Black, Lightweight Stick Vac, Small Upright Vacuum Cleaner, Ideal for Pet Hair, Large Dirt Cup Capacity, Cordless Convenience",224.99,In Stock
B0GTK39HYY,Electrolux UltimateHome 900 Vacuum,https://www.amazon.com/dp/B0GTK39HYY?tag=hotproduct033-20,ok,no_buybox_offer,For Electrolux Replacement Mop Cloths for UltimateHome 900 and UltimateHome 700 Vacuum Cleaner Compatible with 8000,,See All Buying Options
B083JBZXYS,Eureka AirSpeed Ultra-Lightweight Vacuum,https://www.amazon.com/dp/B083JBZXYS?tag=hotproduct033-20,not_found,listing_removed,,,
B0BL5RZMLR,Amazon Fire HD 10 Plus Tablet,https://www.amazon.com/dp/B0BL5RZMLR?tag=hotproduct033-20,blocked,scrape_blocked,,,
B0FN5VQ5JK,ASUS PN53 Mini PC AMD Ryzen 9,https://www.amazon.com/dp/B0FN5VQ5JK?tag=hotproduct033-20,ok,no_buybox_offer,"ASUS PN52 Full System Mini PC with AMD Ryzen 7 5800H Processor, 8GB DDR4-3200MHz RAM, 512GB M.2 PCIE SSD, WiFi 6E, Bluetooth 5.2, 7 x USB, Windows 11 Pro, VESA Mount",,See All Buying Options
B0G25G961Y,Mac Pro M4 Ultra Tower,https://www.amazon.com/dp/B0G25G961Y?tag=hotproduct033-20,ok,suspicious_price,"IVANKY 13-in-1 Mac mini M4 Dock, Docking Station Stand for M5, with M.2 NVMe SSD Enclosure, 4K@144Hz HDMI Hub for Mac mini M4 &M4 Pro (2024), 10 Gbps USB, SD/TF, Audio Ports *2, 20W PD Power Adapter*1",119.99,Only 20 left in stock - order soon.
B0DTLBMJLS,Apple iMac 24-inch M4,https://www.amazon.com/dp/B0DTLBMJLS?tag=hotproduct033-20,ok,no_buybox_offer,"Apple 2024 iMac with Apple M4, 24-inch, 16GB RAM, 256GB SSD Storage Blue (Renewed)",,See All Buying Options
B0FRF2WHJK,HP Elite Mini 800 G9 Desktop PC,https://www.amazon.com/dp/B0FRF2WHJK?tag=hotproduct033-20,blocked,scrape_blocked,,,
B0FWRP2GDW,Lenovo ThinkCentre M90q Gen 4 Tiny PC,https://www.amazon.com/dp/B0FWRP2GDW?tag=hotproduct033-20,blocked,scrape_blocked,,,
B0BHRFZGHG,Dell OptiPlex 3000 Micro Desktop,https://www.amazon.com/dp/B0BHRFZGHG?tag=hotproduct033-20,blocked,scrape_blocked,,,
B0DBMRP8V1,Amazon Fire TV Stick HD,https://www.amazon.com/dp/B0DBMRP8V1?tag=hotproduct033-20,ok,no_buybox_offer,Amazon Fire TV Stick HD bundle with 2-Year Protection Plan,,See All Buying Options
B075SLGR9Z,TiVo Stream 4K Streaming Device,https://www.amazon.com/dp/B075SLGR9Z?tag=hotproduct033-20,not_found,listing_removed,,,
B075RXV2VR,Plex Media Server Streaming Device,https://www.amazon.com/dp/B075RXV2VR?tag=hotproduct033-20,ok,no_buybox_offer,NVIDIA Shield TV | Streaming Media Player with Remote & Game Controller,,See All Buying Options
B0CKQ97Q7C,Xiaomi TV Box S 2nd Gen,https://www.amazon.com/dp/B0CKQ97Q7C?tag=hotproduct033-20,ok,no_buybox_offer,"Remote Control for Xiaomi TV Box S (2nd Gen) 4K,Replacement Remote Control for Mi Box S 2nd Gen with Bluetooth and Voice Remote Control",,See All Buying Options
B0G2BTYY58,Mecool KM2 Plus Android TV Box,https://www.amazon.com/dp/B0G2BTYY58?tag=hotproduct033-20,ok,no_buybox_offer,"Android TV Box 11.0, MECOOL KM2 Plus Deluxe Smart TV Box 4GB 32GB and Android 11.0 TV Box, MECOOL KM2 Plus 2GB 16GB Smart TV Box Bundle",,See All Buying Options
