ASIN,Product Name,Amazon URL,HTTP Status,Reason,Title,Price,Availability
B078C5S3NC,Black+Decker 20V Max Jig Saw Kit,https://www.amazon.com/dp/B078C5S3NC?tag=hotproduct033-20,ok,suspicious_price,BLACK+DECKER 20V MAX* POWERCONNECT Cordless Jig Saw (BDCJS20C),86.0,In Stock
B0BL8BN6LQ,Ryobi 18V ONE+ 4-Tool Combo Kit,https://www.amazon.com/dp/B0BL8BN6LQ?tag=hotproduct033-20,ok,no_buybox_offer,18V Brushless 6-Tool Combo Kit,,See All Buying Options
B0DQ9F3DX8,WEN 4214 12-Inch Variable Speed Drill Press,https://www.amazon.com/dp/B0DQ9F3DX8?tag=hotproduct033-20,ok,suspicious_price,"WEN 12-Inch Benchtop Drill Press, 6.2-Amp Variable Speed Motor with Cast Iron Construction, Laser and LED Work Light (DP1263V)",313.99,In Stock
B0000DD25P,Grizzly Industrial G0715P Combo Lathe,https://www.amazon.com/dp/B0000DD25P?tag=hotproduct033-20,ok,no_buybox_offer,"Grizzly Industrial G4015Z - 19-3/16"" 3/4 HP Combo Lathe/Mill",,See All Buying Options
B0FX55P1NF,Oregon 40V Max Cordless Electric Chainsaw,https://www.amazon.com/dp/B0FX55P1NF?tag=hotproduct033-20,ok,no_buybox_offer,"40V(20V*2) 16"" Brushless Chainsaw Cordless, Electric Chainsaw Fully Compatible with Dewalt 20V MAX, Auto-Oiling, Tool-Free Tensioning, Safety Chain Brake, Batteries and Charger Not Included",,See All Buying Options
B07FPZVK43,NewAge Products Pro 3.0 Series Cabinet Set 9-Piece,https://www.amazon.com/dp/B07FPZVK43?tag=hotproduct033-20,ok,no_buybox_offer,"NewAge Products Bold Series Gray 9 Piece Set, Garage Cabinets, 50525",,See All Buying Options
B07DM8DG1B,FLIR One Pro LT Thermal Imaging Camera,https://www.amazon.com/dp/B07DM8DG1B?tag=hotproduct033-20,ok,no_buybox_offer,FLIR ONE Pro LT - High resolution Thermal Imaging Camera for iOS Smartphones (iPhone w/Lightning Port Only),,See All Buying Options
B0FFD36Z96,Rheem PROPH80 T2 RH80 Prestige Smart Electric Heater,https://www.amazon.com/dp/B0FFD36Z96?tag=hotproduct033-20,ok,no_buybox_offer,Rheem 50 Gal. Smart High Efficiency Hybrid Heat Pump Water Heater with 10-Year Warranty,,See All Buying Options
B0GHLWFVL3,Yamaha P-515 88-Key Digital Piano,https://www.amazon.com/dp/B0GHLWFVL3?tag=hotproduct033-20,ok,no_buybox_offer,"88 Key Piano Keyboard, Semi Weighted Electronic Digital Pia",,See All Buying Options
B07GY8D3KW,Native Instruments Komplete Kontrol A49 MIDI Keyboard,https://www.amazon.com/dp/B07GY8D3KW?tag=hotproduct033-20,ok,no_buybox_offer,Native Instruments Komplete Kontrol A49 Controller Keyboard (25237),,See All Buying Options
B0FNRVVXTV,Rode NT1 5th Generation Cardioid Condenser Mic,https://www.amazon.com/dp/B0FNRVVXTV?tag=hotproduct033-20,blocked,scrape_blocked,,,
B01FRI60LC,Yamaha YFL-222 Standard Flute,https://www.amazon.com/dp/B01FRI60LC?tag=hotproduct033-20,blocked,scrape_blocked,,,
B08NCDVQTG,Hal Leonard Complete Guitar Method Book,https://www.amazon.com/dp/B08NCDVQTG?tag=hotproduct033-20,blocked,scrape_blocked,,,
B0DVZGV2S7,Husqvarna 450e II X-Torq Chainsaw,https://www.amazon.com/dp/B0DVZGV2S7?tag=hotproduct033-20,blocked,scrape_blocked,,,
B0FT5G823Z,Husqvarna Automower 450X Robotic Lawn Mower,https://www.amazon.com/dp/B0FT5G823Z?tag=hotproduct033-20,blocked,scrape_blocked,,,
B007E22C2G,Fiskars 36-Inch Long-Handled Bypass Lopper,https://www.amazon.com/dp/B007E22C2G?tag=hotproduct033-20,ok,no_buybox_offer,"Fiskars Loppers for Tree Trimming, Heavy Duty, with Extendable Handle (24.5""-37"" Range), Sharp Bypass Steel Blade Tree Branch Cutter up to 1.5-Inch Diameter Cut Capacity",,See All Buying Options
B0CTKZXNFL,EGO Power+ LB6002 600 CFM Blower,https://www.amazon.com/dp/B0CTKZXNFL?tag=hotproduct033-20,ok,suspicious_price,EGO POWER+ Leaf Blower Cordless 765 CFM with 56V 5.0Ah Battery and 320W Charger Included (LB7654) Plus Extra 2.5Ah Battery (BA1400T),439.99,In Stock
B004RUH8TA,Orbit 21-Piece Drip Irrigation Kit,https://www.amazon.com/dp/B004RUH8TA?tag=hotproduct033-20,ok,no_buybox_offer,"Orbit 67431 1/4"" Barb 30-Piece Drip Irrigation, Drip Fitting Assortment, 10 Couplings, 10 Plugs, 5 Tees, and 5 Elbows",,See All Buying Options
B0GC12JG7G,SOLOS AirGo 3 Smart Audio Glasses,https://www.amazon.com/dp/B0GC12JG7G?tag=hotproduct033-20,blocked,scrape_blocked,,,
B0D3JFBXTC,Samsung Galaxy Ring Smart Ring,https://www.amazon.com/dp/B0D3JFBXTC?tag=hotproduct033-20,ok,suspicious_price,"SAMSUNG Galaxy Ring, AI Smart Ring, Size First w/Sizing Kit, No App Subscription, Fitness Monitor, Sleep Tracker, Up to 7-Day Battery, Size 12, Titanium Silver [US Version, 1Yr Manufacturer Warranty]",299.99,In Stock
B0FWB9NFCH,Acer Predator Triton 16 Gaming Laptop 2024,https://www.amazon.com/dp/B0FWB9NFCH?tag=hotproduct033-20,blocked,scrape_blocked,,,
B08R6D1X2F,Lorex 4K Color Night Vision IP Security Camera,https://www.amazon.com/dp/B08R6D1X2F?tag=hotproduct033-20,ok,suspicious_price,Lorex Outdoor 4K IP Add-On Metal Bullet Security Camera | NVR Add-On | Smart Motion Detection | 2-Way Talk | Color Night Vision | IP67 Waterproof | Requires Recorder,114.99,In Stock
B0FL2F3W34,Autonomous ErgoChair Pro+ Office Chair,https://www.amazon.com/dp/B0FL2F3W34?tag=hotproduct033-20,ok,no_buybox_offer,"AUTONOMOUS ErgoChair Pro Black Foam Ergonomic Office Chair For Back Pain Relief Adjustable Lumbar Support, Headrest, Big And Tall Home Office Desk Chair Comfy 300 LBS with Swivel Wheels For Long Hours",,See All Buying Options
B0G2947C7H,IKEA BEKANT Corner Desk Sit-Stand,https://www.amazon.com/dp/B0G2947C7H?tag=hotproduct033-20,ok,suspicious_price,"Korfile L Shaped Electric Standing Desk,63 Inch Adjustable Height Sit to Stand Corner Desk with Memory Presets, Reversible Computer Table for Home Office, Work and Study, Black",169.99,In Stock
B07QG4PZQS,Knoll ReGeneration Work Chair,https://www.amazon.com/dp/B07QG4PZQS?tag=hotproduct033-20,ok,suspicious_price,"XUER Ergonomic Office Chair, Mesh Computer Desk Chair with Adjustable Sponge Lumbar Support, Thick Cushion, PU Armrest and Headrest, High Back Swivel Home Office Task Chair for Work (Black)…",199.99,Only 20 left in stock - order soon.
B08FCV5YSS,Victrix Gambit Dual Core Esports Headset,https://www.amazon.com/dp/B08FCV5YSS?tag=hotproduct033-20,ok,no_buybox_offer,"Victrix Gambit World's Fastest Licensed Xbox Controller, Elite Esports Design with Swappable Pro Thumbsticks, Custom Paddles, Swappable White / Purple Faceplate for Xbox One, Series X/S, PC",,See All Buying Options
B0C3QS9P42,HyperX Cloud Stinger 2 Wireless Headset,https://www.amazon.com/dp/B0C3QS9P42?tag=hotproduct033-20,ok,no_buybox_offer,"HyperX Cloud Stinger 2 - Wireless Gaming Headset – Compatible with PC. Noise-Cancelling Swivel-to-Mute Microphone, Comfortable Memory Foam, UP to 20 Hours of Battery Life (Renewed) - Grade A",,See All Buying Options
B0FB9HGFQV,Google Nest Hub 3rd Gen,https://www.amazon.com/dp/B0FB9HGFQV?tag=hotproduct033-20,ok,no_buybox_offer,"Google Nest Hub (2nd Gen) 7-inch Display, 2nd Generation, GA01331-INTL (Renewed)",,See All Buying Options
B0G27G6MLR,Samsung Galaxy Tab S6 Lite 2024,https://www.amazon.com/dp/B0G27G6MLR?tag=hotproduct033-20,ok,no_buybox_offer,"SAMSUNG Galaxy Tab S6 Lite 10.4"" 64GB (2024 Model - International Version) WiFi Android Tablet with S Pen (Mint) (Renewed)",,See All Buying Options
B09BG5P9JH,Amazon Fire 7 2022 Tablet,https://www.amazon.com/dp/B09BG5P9JH?tag=hotproduct033-20,ok,no_buybox_offer,"Amazon Fire HD 8 Plus tablet, 8” HD Display, 64 GB, 30% faster processor, 3GB RAM, wireless charging, (2022 release), Gray",,See All Buying Options
B0C2LSGXR1,TCL Tab 10 FHD Tablet,https://www.amazon.com/dp/B0C2LSGXR1?tag=hotproduct033-20,ok,no_buybox_offer,"TCL Tablet (Renewed) (Tab Pro 5G (10.4"" | Verizon))",,See All Buying Options
B0GFB8N1V3,ASUS ProArt Station PD5 Desktop PC,https://www.amazon.com/dp/B0GFB8N1V3?tag=hotproduct033-20,blocked,scrape_blocked,,,
B0G6JVPH73,Geniatech MyGica ATV1960 Android TV Box,https://www.amazon.com/dp/B0G6JVPH73?tag=hotproduct033-20,ok,no_buybox_offer,"Android TV Box 4GB RAM 32GB, Smart TV Box Android 4K Ultra HD, 2.4G/5G Dual-Band WiFi 6, Support 100M Ethernet, Bluetooth 5.0, USB 2.0, for Home Theater",,See All Buying Options
B0G6JVPH73,MATRICOM G-Box Q4 Android TV Box,https://www.amazon.com/dp/B0G6JVPH73?tag=hotproduct033-20,ok,no_buybox_offer,"Android TV Box 4GB RAM 32GB, Smart TV Box Android 4K Ultra HD, 2.4G/5G Dual-Band WiFi 6, Support 100M Ethernet, Bluetooth 5.0, USB 2.0, for Home Theater",,See All Buying Options
B0DNMZ3SK7,Clé de Peau Beauté Synactif Soap 125g,https://www.amazon.com/dp/B0DNMZ3SK7?tag=hotproduct033-20,suspect,scrape_suspect,,,
B0CNKYW5ZT,The Creative Act by Rick Rubin,https://www.amazon.com/dp/B0CNKYW5ZT?tag=hotproduct033-20,not_found,listing_removed,,,
B0CQQSR2HQ,Same as Ever by Morgan Housel,https://www.amazon.com/dp/B0CQQSR2HQ?tag=hotproduct033-20,ok,no_live_price,Same as Ever (Hindi) (Hindi Edition),,
B0DDHLF6M3,Slow Productivity by Cal Newport,https://www.amazon.com/dp/B0DDHLF6M3?tag=hotproduct033-20,blocked,scrape_blocked,,,
B0F5JVLB11,Keurig K-Supreme Plus Smart Coffee Maker,https://www.amazon.com/dp/B0F5JVLB11?tag=hotproduct033-20,ok,no_buybox_offer,"Keurig K-Supreme Single Serve K-Cup Pod Coffee Maker, MultiStream Technology, 4 Brew Sizes, 66oz Dual-Position Removable Reservoir, Black (Renewed)",,See All Buying Options
B08T8L371P,Glow Recipe Watermelon Glow Niacinamide Dew Drops,https://www.amazon.com/dp/B08T8L371P?tag=hotproduct033-20,ok,no_buybox_offer,"Glow Recipe Watermelon Niacinamide Dew Drops, Korean Niacinamide Serum Drops, Hydrating Face Serum + Primer & Liquid Highlighter, Hyaluronic Acid, Dewy Glow (40ml)",,See All Buying Options
B018A0MGH6,Youth To The People Superfood Air-Whip Moisture Cream,https://www.amazon.com/dp/B018A0MGH6?tag=hotproduct033-20,ok,no_buybox_offer,"Youth To The People Superfood Air-Whip Moisture Cream - Kale + Green Tea Hyaluronic Acid Face Moisturizer, 48-HR Hydration with Dewy Glow, Non-Greasy Lightweight Gel, Makeup Primer, Non-comedogenic",,See All Buying Options
B0GRQ3PR9R,HP Chromebook 14a Laptop,https://www.amazon.com/dp/B0GRQ3PR9R?tag=hotproduct033-20,ok,suspicious_price,"HP 14” Laptop Ultra-Portable Computer 2026 Student Business, MS Office, Copilot AI, Intel 4-Core CPU, 4GB RAM, 628GB Storage (128GB UFS+500GB Ext), Long Battery, MaxsolAccessory, Win 11 Pro, Sky Blue",299.0,In Stock
B07QNM7YDM,Roomba 694 Robot Vacuum Wi-Fi Connected,https://www.amazon.com/dp/B07QNM7YDM?tag=hotproduct033-20,ok,no_buybox_offer,"iRobot Roomba E5 (5150) Robot Vacuum - Wi-Fi Connected, Works with Alexa, Ideal for Pet Hair, Carpets, Hard, Self-Charging Robotic Vacuum, Black",,See All Buying Options
B07J9RBWW5,GE CYNC Smart Lighting Starter Kit,https://www.amazon.com/dp/B07J9RBWW5?tag=hotproduct033-20,ok,suspicious_price,"GE Lighting CYNC Smart Light Bulbs, Bluetooth Enabled, Alexa and Google Home Compatible, Soft White (2Pack), Packaging May Vary",7.12,
B08DG7ZYYS,ZIIP Beauty HALO Device,https://www.amazon.com/dp/B08DG7ZYYS?tag=hotproduct033-20,blocked,scrape_blocked,,,
B08QXB9BH5,Ninja Creami Ice Cream Maker,https://www.amazon.com/dp/B08QXB9BH5?tag=hotproduct033-20,ok,suspicious_price,"Ninja NC301 CREAMi Ice Cream Maker, for Gelato, Mix-ins, Milkshakes, Sorbet, Smoothie Bowls & More, 7 One-Touch Programs, with (2) Pint Containers & Lids, Compact Size, Perfect for Kids, Silver",229.99,In Stock
B09BDK76R2,Philips Hue Gradient Lightstrip 6ft,https://www.amazon.com/dp/B09BDK76R2?tag=hotproduct033-20,ok,no_buybox_offer,"Philips Hue Indoor 6-Foot Smart LED Light Strip Base Kit with Plug - Flowing Multicolor Effect - 1 Pack - Control with Hue App - Compatible with Alexa, Google Assistant and Apple HomeKit",,See All Buying Options
B0C278H4GB,Garmin Forerunner 265 GPS Running Watch,https://www.amazon.com/dp/B0C278H4GB?tag=hotproduct033-20,ok,no_buybox_offer,"Garmin Forerunner 265 Running Smartwatch, Colorful AMOLED Display, Training Metrics and Recovery Insights, Black and Powder Gray (Renewed)",,See All Buying Options
B0F5YYYNGW,Shiseido Ultimune Power Infusing Concentrate,https://www.amazon.com/dp/B0F5YYYNGW?tag=hotproduct033-20,ok,suspicious_price,Shiseido Ultimune Power Infusing Serum - Breakthrough Lightweight Face Serum - Boosts Radiance & Improves Visible Signs of Aging - All Skin Types - Non-Comedogenic,68.0,In Stock
B0GRGF479Q,"Electric Toothbrush, Sonic Type for Adults & Teens",https://www.amazon.com/dp/B0GRGF479Q?tag=hotproduct033-20,ok,suspicious_price,"Electric Toothbrush, Sonic Type for Adults & Teens, 8 Brush Heads, Travel Case, 6 Modes, 40000 VPM Electric Motor, IPX7 Waterproof, 2 Minutes Timer, Wireless Charging, One Charge for 100 Days-Black",75.99,In Stock
B0FGXGNZWY,"Electric Drum Set with Dual Speaker, Electronic Drum Pad and Sticks Kit Supports REC",https://www.amazon.com/dp/B0FGXGNZWY?tag=hotproduct033-20,ok,suspicious_price,"Electric Drum Set with Dual Speaker, Electronic Drum Pad and Sticks Kit Supports REC, Portable Roll Up Drums Practice Pad",49.99,In Stock
B07ZX1XGXR,Best Choice Products 41in Full Size Beginner All Wood Acoustic Guitar Starter Set w/Gig Bag,https://www.amazon.com/dp/B07ZX1XGXR?tag=hotproduct033-20,ok,suspicious_price,"Best Choice Products 41in Full Size Beginner All Wood Acoustic Guitar Starter Set w/Gig Bag, Strap, Capo, Strings, Picks - Sunburst",149.99,Only 8 left in stock - order soon.
B09HR5KSR8,"K18 Leave-In Molecular Repair Hair Mask, Patented",https://www.amazon.com/dp/B09HR5KSR8?tag=hotproduct033-20,ok,suspicious_price,"K18 Leave-In Molecular Repair Hair Mask, Patented, Lasting Repair For Dry, Frizzy, Damaged Hair, Reverse Damage In 4 Minutes From Bleach, Color, Chemical Services + Heat",54.02,
B00R3Z49G6,Amazon Basics 14-Piece High Carbon Stainless Steel Kitchen Knife Set with Full Tang Construction,https://www.amazon.com/dp/B00R3Z49G6?tag=hotproduct033-20,ok,suspicious_price,"Amazon Basics 14-Piece High Carbon Stainless Steel Kitchen Knife Set with Full Tang Construction, Ergonomic Handles, Sharpener and Pinewood Block, Black",24.99,In Stock
B0FJKZGF9P,"SHAN ZU 16 Pieces Knife Set, Knife Block Set in Powder Steel",https://www.amazon.com/dp/B0FJKZGF9P?tag=hotproduct033-20,ok,no_buybox_offer,"SHAN ZU 16 Pieces Knife Set, Knife Block Set in Powder Steel, Ultra Sharp Kitchen Knives Set, High Hardness Japanese Knife Set with Ergonomic Pakkawood Handle, Chef Knives Set for Kitchen Cooking",,See All Buying Options
B09YQY517H,Brewin CHEFILOSOPHI Japanese Chef Knife Set 5 PCS,https://www.amazon.com/dp/B09YQY517H?tag=hotproduct033-20,ok,suspicious_price,"Brewin CHEFILOSOPHI Japanese Chef Knife Set 5 PCS with Elegant Red Pakkawood Handle Ergonomic Design,Professional Ultra Sharp Kitchen Knives for Cooking High Carbon Stainless Steel",35.99,In Stock
B09H8CWFNK,"Shark AV2501S AI Ultra Robot Vacuum, with Matrix Clean",https://www.amazon.com/dp/B09H8CWFNK?tag=hotproduct033-20,ok,suspicious_price,"Shark AV2501S AI Ultra Robot Vacuum, with Matrix Clean, Home Mapping, 30-Day Capacity HEPA Bagless Self Empty Base, Perfect for Pet Hair, Wifi, Dark Grey",447.95,Only 7 left in stock - order soon.
B00AVM2PQ4,"Versace Perfume for Women Variety 3-Piece Mini Gift Set – Yellow Diamond, Crystal Noir, Bright Crystal",https://www.amazon.com/dp/B00AVM2PQ4?tag=hotproduct033-20,ok,no_buybox_offer,"Versace Perfume for Women Variety 3-Piece Mini Gift Set – Yellow Diamond, Crystal Noir, Bright Crystal",,See All Buying Options
B000Z6EXK2,"Versace Women's Bright Crystal Mini, 0.17 Fl Oz",https://www.amazon.com/dp/B000Z6EXK2?tag=hotproduct033-20,ok,suspicious_price,"Versace Women's Bright Crystal Mini, 0.17 Fl Oz",85.47,
B01FHOWYA2,"Ninja Fit Compact Personal Blender, Portable Blender for-Smoothies",https://www.amazon.com/dp/B01FHOWYA2?tag=hotproduct033-20,ok,no_buybox_offer,"Ninja Fit Compact Personal Blender | For Smoothies, Shakes & Frozen Drinks | (2) 16-oz. To-Go Cups with Spout Lids | 700-Watt Countertop | Black | QB3001SS",,See All Buying Options
B0DPNJVG1Z,"BELLA 12 Cup Programmable Coffee Marker, Reusable Dishwasher Safe Accessories",https://www.amazon.com/dp/B0DPNJVG1Z?tag=hotproduct033-20,ok,suspicious_price,"BELLA 12 Cup Programmable Coffee Maker, Reusable Dishwasher Safe Accessories, Easy LCD display, Auto Shutoff, 900 watt, Oatmilk",39.99,In Stock
B002YI2IG0,"Mr. Coffee Black Coffee Maker, 12 Cups, with Auto Pause and Glass Carafe, Perfect for Home and Office Use",https://www.amazon.com/dp/B002YI2IG0?tag=hotproduct033-20,ok,suspicious_price,"Mr. Coffee Black Coffee Maker, 12 Cups, with Auto Pause and Glass Carafe, Perfect for Home and Office Use",40.0,In Stock
B071J1PBQ6,"The Ordinary Matrixyl 10% + Hyaluronic Acid, Anti-Aging Serum for Fine Lines and Wrinkles, 1 Fl Oz",https://www.amazon.com/dp/B071J1PBQ6?tag=hotproduct033-20,ok,suspicious_price,"The Ordinary Matrixyl 10% + Hyaluronic Acid, Anti-Aging Serum for Fine Lines and Wrinkles, 1 Fl Oz",10.9,In Stock
B0C9DXGXZ3,"The Ordinary Multi-Peptide + Copper Peptides 1%, GHK-Cu Anti-Aging Serum for Fine Lines and Skin Elasticity",https://www.amazon.com/dp/B0C9DXGXZ3?tag=hotproduct033-20,ok,suspicious_price,"The Ordinary Multi-Peptide + Copper Peptides 1%, GHK-Cu Anti-Aging Serum for Fine Lines and Skin Elasticity",32.0,In Stock
B0779YGB2G,"The Ordinary Retinol 1% in Squalane, High-Strength Retinol Serum for Anti-Aging and Skin Smoothing",https://www.amazon.com/dp/B0779YGB2G?tag=hotproduct033-20,ok,suspicious_price,"The Ordinary Retinol 1% in Squalane, High-Strength Retinol Serum for Anti-Aging and Skin Smoothing",9.9,In Stock
B0BLHW7JZM,"The Ordinary Multi-Peptide + Hyaluronic Acid, Anti-Aging Peptide Serum for Crow’s Feet, Elasticity & Firmness, 1 Fl Oz",https://www.amazon.com/dp/B0BLHW7JZM?tag=hotproduct033-20,ok,suspicious_price,"The Ordinary Multi-Peptide + Hyaluronic Acid, Anti-Aging Peptide Serum for Crow’s Feet, Elasticity & Firmness, 1 Fl Oz",19.9,In Stock
B07GVCVYB9,L'Oreal Paris Revitalift 1.5% Pure Hyaluronic Acid Serum for Face,https://www.amazon.com/dp/B07GVCVYB9?tag=hotproduct033-20,ok,suspicious_price,"L'Oreal Paris Revitalift 1.5% Pure Hyaluronic Acid Serum for Face, Anti Aging Serum to Hydrate Skin & Reduce Wrinkles, Fragrance Free Skin Care for All Skin Types, 1 Oz",24.99,In Stock
B0GQXTQX97,"RoowLtne Retinol Serum for Face & Neck,Anti Aging Face Serum with Collagen & Boost Hydration Formula,Targets Wrinkles",https://www.amazon.com/dp/B0GQXTQX97?tag=hotproduct033-20,not_found,listing_removed,,,
B0CNJ1Z2GL,LANEIGE Water Bank Blue Hyaluronic Cream Moisturizer: Hydrating Korean Face Cream,https://www.amazon.com/dp/B0CNJ1Z2GL?tag=hotproduct033-20,blocked,scrape_blocked,,,
B09QBB8ZL4,"TATCHA The Dewy Skin Cream | Rich Face Cream to Hydrate, Plump and Protect Dry and Combo Skin,",https://www.amazon.com/dp/B09QBB8ZL4?tag=hotproduct033-20,ok,no_buybox_offer,"TATCHA The Dewy Skin Cream | Rich Face Cream to Hydrate, Plump and Protect Dry and Combo Skin,",,See All Buying Options
B07MZ6X83Q,Shiseido Benefiance Wrinkle Smoothing Day Cream,https://www.amazon.com/dp/B07MZ6X83Q?tag=hotproduct033-20,ok,suspicious_price,Shiseido Benefiance Wrinkle Smoothing Day Cream - 50 mL - Broad-Spectrum SPF 23 Anti-Aging Moisturizer - Visibly Corrects Wrinkles & Intensely Hydrates - Non-Comedogenic,31.2,
B0DNRQSR9P,Paula's Choice Pro-Collagen Peptide Plumping Face Moisturizer,https://www.amazon.com/dp/B0DNRQSR9P?tag=hotproduct033-20,ok,suspicious_price,"Paula's Choice Pro-Collagen Peptide Plumping Face Moisturizer, Daily Gel Face Cream for Deep Lightweight Hydration, Wrinkles & Loss of Firmness, Fragrance-Free, 1.7 Fl Oz",34.3,In Stock
B09BG477N1,"Naturium Multi-Peptide Moisturizer, Hydrating & Smoothing Skin Care",https://www.amazon.com/dp/B09BG477N1?tag=hotproduct033-20,ok,suspicious_price,"Naturium Multi-Peptide Moisturizer, Hydrating & Smoothing Skin Care, Moisturizes with Ethylated Vitamin C & Panthenol, 1.7 oz",10.52,
B000PKYCJA,Dermalogica Super Rich Repair Anti-Aging Super-Concentrated Face Moisturizer,https://www.amazon.com/dp/B000PKYCJA?tag=hotproduct033-20,blocked,scrape_blocked,,,
B0CBZW4DKF,Since the Day We Danced (Hadley Cove Sweet Romance Book 1),https://www.amazon.com/dp/B0CBZW4DKF?tag=hotproduct033-20,ok,suspicious_price,Since the Day We Danced (Hadley Cove Sweet Romance Book 1),26.99,
B09ZKS5PQP,Make Me Lose: a small-town enemies-to-lovers romance (Bayshore Book 1),https://www.amazon.com/dp/B09ZKS5PQP?tag=hotproduct033-20,blocked,scrape_blocked,,,
B08W5HMCQ9,Claiming Her Forever: A Small Town Alpha Mountain Man Romance (Men of Rocky Mountain Book 1),https://www.amazon.com/dp/B08W5HMCQ9?tag=hotproduct033-20,blocked,scrape_blocked,,,
B0F2GJQWB9,Returning Home: A Sweet Small Town Best Friend's Brother Romance (Alder Creek Book 1),https://www.amazon.com/dp/B0F2GJQWB9?tag=hotproduct033-20,blocked,scrape_blocked,,,
B09K4FCGXG,Built Of Secrets (Small Town Heroes Romance Book 1),https://www.amazon.com/dp/B09K4FCGXG?tag=hotproduct033-20,ok,suspicious_price,Built Of Secrets (Small Town Heroes Romance Book 1),0.99,
B077ZBQZLZ,The Little Cottage on the Hill: A gorgeous feel good romance to escape with (The Little Cottage Series Book 1),https://www.amazon.com/dp/B077ZBQZLZ?tag=hotproduct033-20,ok,suspicious_price,The Little Cottage on the Hill: A gorgeous feel good romance to escape with (The Little Cottage Series Book 1),0.99,
B07D7LPC3J,The Billionaire's Secret Marriage (The Limitless Sweet Billionaire Romance Series Book 1),https://www.amazon.com/dp/B07D7LPC3J?tag=hotproduct033-20,ok,suspicious_price,The Billionaire's Secret Marriage (The Limitless Sweet Billionaire Romance Series Book 1),5.99,
B0CW1HYCPQ,Rescue the Night (A Hartley's Nest Romance Book 1),https://www.amazon.com/dp/B0CW1HYCPQ?tag=hotproduct033-20,ok,suspicious_price,Rescue the Night (A Hartley's Nest Romance Book 1),5.99,
B01CT2VV90,Just For This Moment: A Small Town Southern Romance (Wishful Romance Book 4),https://www.amazon.com/dp/B01CT2VV90?tag=hotproduct033-20,ok,suspicious_price,Just For This Moment: A Small Town Southern Romance (Wishful Romance Book 4),13.99,
B0BXQ3LKRN,Just One Date (Billionaire Barons of Texas Book 1),https://www.amazon.com/dp/B0BXQ3LKRN?tag=hotproduct033-20,ok,suspicious_price,Just One Date (Billionaire Barons of Texas Book 1),0.99,
B07JDQHSLN,Good Girl: A Rockstar Romance (Wicked Book 1),https://www.amazon.com/dp/B07JDQHSLN?tag=hotproduct033-20,ok,suspicious_price,Good Girl: A Rockstar Romance (Wicked Book 1),2.99,
B07RWDH7XK,Enemies With Benefits: An Enemies-to-Lovers Romance (Loveless Brothers Romance Book 1),https://www.amazon.com/dp/B07RWDH7XK?tag=hotproduct033-20,ok,suspicious_price,Enemies With Benefits: An Enemies-to-Lovers Romance (Loveless Brothers Romance Book 1),18.99,
B0BT8VH3ZN,The Charming Billionaire: An Opposites Attract Romance (The Baltimore Boys Book 1),https://www.amazon.com/dp/B0BT8VH3ZN?tag=hotproduct033-20,ok,suspicious_price,The Charming Billionaire: An Opposites Attract Romance (The Baltimore Boys Book 1),5.99,
B0BS4DBXZ1,Just One Kiss (A Porch by the Sea—Book One),https://www.amazon.com/dp/B0BS4DBXZ1?tag=hotproduct033-20,ok,suspicious_price,Just One Kiss (A Porch by the Sea—Book One),2.99,
B01MRM8LY2,"The Beginning of Loss - A Billionaire Romance Novel (Romance, Billionaire Romance, Life After Love Book 1)",https://www.amazon.com/dp/B01MRM8LY2?tag=hotproduct033-20,ok,suspicious_price,"The Beginning of Loss - A Billionaire Romance Novel (Romance, Billionaire Romance, Life After Love Book 1)",2.99,
B09NRSWR1H,The Scent of Happiness (The Seven Senses Book 1),https://www.amazon.com/dp/B09NRSWR1H?tag=hotproduct033-20,ok,suspicious_price,The Scent of Happiness (The Seven Senses Book 1),4.99,
B0C42D3574,Foolish Mistakes: An Enemies to Lovers Romance (Seaforth Billionaires Series Book 1),https://www.amazon.com/dp/B0C42D3574?tag=hotproduct033-20,ok,suspicious_price,Foolish Mistakes: An Enemies to Lovers Romance (Seaforth Billionaires Series Book 1),2.99,
B0BML56C95,Snowflake Creek Box Set: Books 1-3 (Snowflake Creek Bundles),https://www.amazon.com/dp/B0BML56C95?tag=hotproduct033-20,ok,suspicious_price,Snowflake Creek Box Set: Books 1-3 (Snowflake Creek Bundles),5.99,
B0BZMZGH74,Accidentally in Bloom: An Enemies-to-Lovers,https://www.amazon.com/dp/B0BZMZGH74?tag=hotproduct033-20,blocked,scrape_blocked,,,
B08T7N16CW,Breathe: Enemies to Lovers Female Boss Romance (A Price Family Romance Novel Book 1),https://www.amazon.com/dp/B08T7N16CW?tag=hotproduct033-20,ok,suspicious_price,Breathe: Enemies to Lovers Female Boss Romance (A Price Family Romance Novel Book 1),2.99,
B0FSNGVSKH,The 100 Best Nonfiction Books of All Time: Essential Nonfiction Classics Every Reader Should Know (Caterthun Classics),https://www.amazon.com/dp/B0FSNGVSKH?tag=hotproduct033-20,ok,suspicious_price,The 100 Best Nonfiction Books of All Time: Essential Nonfiction Classics Every Reader Should Know (Caterthun Classics),9.99,
B00CATSONE,Nikola Tesla: Imagination and the Man That Invented the 20th Century,https://www.amazon.com/dp/B00CATSONE?tag=hotproduct033-20,ok,suspicious_price,Nikola Tesla: Imagination and the Man That Invented the 20th Century,2.99,
B0GQC4CXHD,"SIMPLE HEALTH HABITS: Small Changes for Energy, Longevity, and Feeling Your Best (Simple Habits for Big Results Book 2)",https://www.amazon.com/dp/B0GQC4CXHD?tag=hotproduct033-20,ok,suspicious_price,"SIMPLE HEALTH HABITS: Small Changes for Energy, Longevity, and Feeling Your Best (Simple Habits for Big Results Book 2)",12.99,
B07N5WYKD2,1% Success Habits: 10 Daily Habits to Crush Your Day,https://www.amazon.com/dp/B07N5WYKD2?tag=hotproduct033-20,ok,suspicious_price,1% Success Habits: 10 Daily Habits to Crush Your Day,0.99,
B01CEMHIYC,The Art Of Letting Go,https://www.amazon.com/dp/B01CEMHIYC?tag=hotproduct033-20,ok,suspicious_price,The Art Of Letting Go,2.99,
B000OCXIJE,The Paid Companion,https://www.amazon.com/dp/B000OCXIJE?tag=hotproduct033-20,ok,suspicious_price,The Paid Companion,9.99,
